,director_name,actor_2_name,genres,actor_1_name,movie_title,actor_3_name,combined
1129,Yimou Zhang,Ye Liu,Drama Romance,Li Gong,Curse of the Golden Flower,Man Li,Yimou Zhang Ye Liu Drama Romance Li Gong Man Li
1130,Danny Pang,Charlie Yeung,Action Crime Thriller,Nicolas Cage,Bangkok Dangerous,James With,Danny Pang Charlie Yeung Action Crime Thriller Nicolas Cage James With
1131,Barry Sonnenfeld,Janeane Garofalo,Comedy Crime Thriller,Zooey Deschanel,Big Trouble,Omar Epps,Barry Sonnenfeld Janeane Garofalo Comedy Crime Thriller Zooey Deschanel Omar Epps
1132,Mike Newell,Giovanna Mezzogiorno,Drama Romance,Marcela Mar,Love in the Time of Cholera,Unax Ugalde,Mike Newell Giovanna Mezzogiorno Drama Romance Marcela Mar Unax Ugalde
1134,George P. Cosmatos,Ben Gazzara,Action Thriller,Sam Waterston,Shadow Conspiracy,Nicholas Turturro,George P. Cosmatos Ben Gazzara Action Thriller Sam Waterston Nicholas Turturro
1135,Oliver Parker,Tim McInnerny,Action Adventure Comedy Crime,Daniel Kaluuya,Johnny English Reborn,Togo Igawa,Oliver Parker Tim McInnerny Action Adventure Comedy Crime Daniel Kaluuya Togo Igawa
1136,Lawrence Kasanoff,Larry Miller,Action Animation Comedy Family Fantasy,Jerry Stiller,Foodfight!,Harvey Fierstein,Lawrence Kasanoff Larry Miller Action Animation Comedy Family Fantasy Jerry Stiller Harvey Fierstein
1137,Ben Affleck,Scoot McNairy,Biography Drama History Thriller,Clea DuVall,Argo,Tate Donovan,Ben Affleck Scoot McNairy Biography Drama History Thriller Clea DuVall Tate Donovan
1138,Andrew Davis,Daniel Roebuck,Action Adventure Crime Drama Mystery Thriller,Harrison Ford,The Fugitive,Sela Ward,Andrew Davis Daniel Roebuck Action Adventure Crime Drama Mystery Thriller Harrison Ford Sela Ward
1139,Andy Tennant,Dorian Missick,Action Comedy Romance,Gerard Butler,The Bounty Hunter,Peter Greene,Andy Tennant Dorian Missick Action Comedy Romance Gerard Butler Peter Greene
1140,Barry Levinson,Brad Pitt,Crime Drama Thriller,Robert De Niro,Sleepers,Minnie Driver,Barry Levinson Brad Pitt Crime Drama Thriller Robert De Niro Minnie Driver
1141,George P. Cosmatos,Julia Nickson,Action Adventure Thriller War,Sylvester Stallone,Rambo: First Blood Part II,Martin Kove,George P. Cosmatos Julia Nickson Action Adventure Thriller War Sylvester Stallone Martin Kove
1142,Brian Gibson,Demi Moore,Drama Thriller,Joseph Gordon-Levitt,The Juror,Anne Heche,Brian Gibson Demi Moore Drama Thriller Joseph Gordon-Levitt Anne Heche
1143,Norman Ferguson,Dickie Jones,Animation Family Fantasy Musical,Mel Blanc,Pinocchio,Cliff Edwards,Norman Ferguson Dickie Jones Animation Family Fantasy Musical Mel Blanc Cliff Edwards
1144,Michael Cimino,Sam Waterston,Adventure Drama Western,Jeff Bridges,Heaven's Gate,Isabelle Huppert,Michael Cimino Sam Waterston Adventure Drama Western Jeff Bridges Isabelle Huppert
1145,Len Wiseman,Tony Curran,Action Adventure Fantasy Sci-Fi Thriller,Sophia Myles,Underworld: Evolution,Derek Jacobi,Len Wiseman Tony Curran Action Adventure Fantasy Sci-Fi Thriller Sophia Myles Derek Jacobi
1146,Paul McGuigan,Spencer Wilding,Drama Horror Sci-Fi Thriller,Daniel Radcliffe,Victor Frankenstein,Daniel Mays,Paul McGuigan Spencer Wilding Drama Horror Sci-Fi Thriller Daniel Radcliffe Daniel Mays
1147,Gus Van Sant,Rob Brown,Drama,F. Murray Abraham,Finding Forrester,Michael Nouri,Gus Van Sant Rob Brown Drama F. Murray Abraham Michael Nouri
1148,Betty Thomas,Viggo Mortensen,Comedy Drama,Steve Buscemi,28 Days,Elizabeth Perkins,Betty Thomas Viggo Mortensen Comedy Drama Steve Buscemi Elizabeth Perkins
1149,Louis Leterrier,Jet Li,Action Crime Drama Thriller,Morgan Freeman,Unleashed,Bob Hoskins,Louis Leterrier Jet Li Action Crime Drama Thriller Morgan Freeman Bob Hoskins
1150,Roger Kumble,Lillian Adams,Comedy Romance,Judith Chapman,The Sweetest Thing,Chelsea Bond,Roger Kumble Lillian Adams Comedy Romance Judith Chapman Chelsea Bond
1151,Sydney Pollack,Holly Hunter,Drama Mystery Thriller,Tom Cruise,The Firm,Wilford Brimley,Sydney Pollack Holly Hunter Drama Mystery Thriller Tom Cruise Wilford Brimley
1152,Burr Steers,Charlie Tahan,Drama Fantasy Romance,Augustus Prew,Charlie St. Cloud,Valerie Tian,Burr Steers Charlie Tahan Drama Fantasy Romance Augustus Prew Valerie Tian
1153,Simon West,Tony Goldwyn,Action Crime Thriller,Jason Statham,The Mechanic,Mini Anden,Simon West Tony Goldwyn Action Crime Thriller Jason Statham Mini Anden
1154,Phil Lord,Dax Flame,Action Comedy Crime,Channing Tatum,21 Jump Street,Rob Riggle,Phil Lord Dax Flame Action Comedy Crime Channing Tatum Rob Riggle
1155,Roger Michell,Clarke Peters,Comedy Drama Romance,Julia Roberts,Notting Hill,Dylan Moran,Roger Michell Clarke Peters Comedy Drama Romance Julia Roberts Dylan Moran
1156,Peter Lord,Miranda Richardson,Adventure Animation Comedy Drama Family,Imelda Staunton,Chicken Run,Julia Sawalha,Peter Lord Miranda Richardson Adventure Animation Comedy Drama Family Imelda Staunton Julia Sawalha
1157,John Hamburg,Masi Oka,Comedy Romance,Philip Seymour Hoffman,Along Came Polly,Debra Messing,John Hamburg Masi Oka Comedy Romance Philip Seymour Hoffman Debra Messing
1158,Reginald Hudlin,Eartha Kitt,Comedy Drama Romance,John Witherspoon,Boomerang,Geoffrey Holder,Reginald Hudlin Eartha Kitt Comedy Drama Romance John Witherspoon Geoffrey Holder
1159,Paul Feig,William Xifaras,Action Comedy Crime,Michael Rapaport,The Heat,Demián Bichir,Paul Feig William Xifaras Action Comedy Crime Michael Rapaport Demián Bichir
1160,Joseph L. Mankiewicz,Richard Burton,Biography Drama History Romance,Martin Landau,Cleopatra,Roddy McDowall,Joseph L. Mankiewicz Richard Burton Biography Drama History Romance Martin Landau Roddy McDowall
1161,Frank Coraci,Reggie Lee,Action Comedy Sport,Salma Hayek,Here Comes the Boom,Charice,Frank Coraci Reggie Lee Action Comedy Sport Salma Hayek Charice
1162,Carl Franklin,Adam Scott,Crime Drama Mystery Thriller,Morgan Freeman,High Crimes,Bruce Davison,Carl Franklin Adam Scott Crime Drama Mystery Thriller Morgan Freeman Bruce Davison
1163,Barbra Streisand,Austin Pendleton,Comedy Drama Romance,Jeff Bridges,The Mirror Has Two Faces,Mimi Rogers,Barbra Streisand Austin Pendleton Comedy Drama Romance Jeff Bridges Mimi Rogers
1164,Mark Pellington,Will Patton,Drama Horror Mystery Thriller,Debra Messing,The Mothman Prophecies,David Eigenberg,Mark Pellington Will Patton Drama Horror Mystery Thriller Debra Messing David Eigenberg
1165,Larry Charles,Elton John,Comedy,Bono,Brüno,Slash,Larry Charles Elton John Comedy Bono Slash
1166,John Glen,Talisa Soto,Action Adventure Thriller,Robert Davi,Licence to Kill,Anthony Zerbe,John Glen Talisa Soto Action Adventure Thriller Robert Davi Anthony Zerbe
1167,Catherine Hardwicke,Billy Burke,Fantasy Horror Mystery Thriller,Gary Oldman,Red Riding Hood,Virginia Madsen,Catherine Hardwicke Billy Burke Fantasy Horror Mystery Thriller Gary Oldman Virginia Madsen
1168,John Herzfeld,Charlize Theron,Action Crime Drama Thriller,Robert De Niro,15 Minutes,Kelsey Grammer,John Herzfeld Charlize Theron Action Crime Drama Thriller Robert De Niro Kelsey Grammer
1169,Annabel Jankel,Fisher Stevens,Adventure Comedy Family Fantasy Sci-Fi,Bob Hoskins,Super Mario Bros.,Fiona Shaw,Annabel Jankel Fisher Stevens Adventure Comedy Family Fantasy Sci-Fi Bob Hoskins Fiona Shaw
1170,Andrew Niccol,Jeremy Crutchley,Crime Drama Thriller,Nicolas Cage,Lord of War,Jared Burke,Andrew Niccol Jeremy Crutchley Crime Drama Thriller Nicolas Cage Jared Burke
1171,Yimou Zhang,Tony Chiu Wai Leung,Action Adventure History,Jet Li,Hero,Maggie Cheung,Yimou Zhang Tony Chiu Wai Leung Action Adventure History Jet Li Maggie Cheung
1172,Julie Anne Robinson,Debbie Reynolds,Action Comedy Crime Romance Thriller,Fisher Stevens,One for the Money,Patrick Fischler,Julie Anne Robinson Debbie Reynolds Action Comedy Crime Romance Thriller Fisher Stevens Patrick Fischler
1173,Evan Goldberg,Randall Park,Comedy,James Franco,The Interview,Anders Holm,Evan Goldberg Randall Park Comedy James Franco Anders Holm
1174,Sngmoo Lee,Dong-gun Jang,Action Fantasy Western,Tony Cox,The Warrior's Way,Jed Brophy,Sngmoo Lee Dong-gun Jang Action Fantasy Western Tony Cox Jed Brophy
1176,Jean-Pierre Jeunet,Dany Boon,Action Comedy Crime,Omar Sy,Micmacs,André Dussollier,Jean-Pierre Jeunet Dany Boon Action Comedy Crime Omar Sy André Dussollier
1177,Curtis Hanson,Omar Benson Miller,Drama Music,Mekhi Phifer,8 Mile,Evan Jones,Curtis Hanson Omar Benson Miller Drama Music Mekhi Phifer Evan Jones
1178,Jamel Debbouze,Youssef Hajdi,Adventure Animation Comedy Family,Jamel Debbouze,Animal Kingdom: Let's go Ape,Mélissa Theuriau,Jamel Debbouze Youssef Hajdi Adventure Animation Comedy Family Jamel Debbouze Mélissa Theuriau
1179,Brian Helgeland,Rufus Sewell,Action Adventure Romance,Heath Ledger,A Knight's Tale,Bérénice Bejo,Brian Helgeland Rufus Sewell Action Adventure Romance Heath Ledger Bérénice Bejo
1180,Gordon Chan,Lee Evans,Action Comedy Fantasy,Julian Sands,The Medallion,Anthony Chau-Sang Wong,Gordon Chan Lee Evans Action Comedy Fantasy Julian Sands Anthony Chau-Sang Wong
1181,M. Night Shyamalan,Haley Joel Osment,Drama Mystery Thriller,Bruce Willis,The Sixth Sense,Olivia Williams,M. Night Shyamalan Haley Joel Osment Drama Mystery Thriller Bruce Willis Olivia Williams
1182,Asger Leth,Mandy Gonzalez,Action Crime Thriller,Robert Clohessy,Man on a Ledge,J. Smith-Cameron,Asger Leth Mandy Gonzalez Action Crime Thriller Robert Clohessy J. Smith-Cameron
1183,David Frankel,Kevin Pollak,Comedy,Joel McHale,The Big Year,JoBeth Williams,David Frankel Kevin Pollak Comedy Joel McHale JoBeth Williams
1184,John G. Avildsen,William Zabka,Action Drama Family Sport,Martin Kove,The Karate Kid,William Bassett,John G. Avildsen William Zabka Action Drama Family Sport Martin Kove William Bassett
1185,David O. Russell,Christian Bale,Crime Drama,Jennifer Lawrence,American Hustle,Bradley Cooper,David O. Russell Christian Bale Crime Drama Jennifer Lawrence Bradley Cooper
1186,Anne Fletcher,Denis O'Hare,Comedy Drama Romance,Ryan Reynolds,The Proposal,Craig T. Nelson,Anne Fletcher Denis O'Hare Comedy Drama Romance Ryan Reynolds Craig T. Nelson
1187,Bruce Beresford,Annabeth Gish,Crime Mystery Thriller,Bruce Greenwood,Double Jeopardy,Bruce Campbell,Bruce Beresford Annabeth Gish Crime Mystery Thriller Bruce Greenwood Bruce Campbell
1188,Robert Zemeckis,Jeffrey Weissman,Adventure Comedy Sci-Fi,Lea Thompson,Back to the Future Part II,Thomas F. Wilson,Robert Zemeckis Jeffrey Weissman Adventure Comedy Sci-Fi Lea Thompson Thomas F. Wilson
1189,Luc Besson,Morgan Freeman,Action Sci-Fi Thriller,Scarlett Johansson,Lucy,Amr Waked,Luc Besson Morgan Freeman Action Sci-Fi Thriller Scarlett Johansson Amr Waked
1190,Sam Taylor-Johnson,Luke Grimes,Drama Romance,Jennifer Ehle,Fifty Shades of Grey,Callum Rennie,Sam Taylor-Johnson Luke Grimes Drama Romance Jennifer Ehle Callum Rennie
1191,Robert Rodriguez,Salma Hayek,Action Adventure Comedy Family Sci-Fi,Sylvester Stallone,Spy Kids 3-D: Game Over,Alexa PenaVega,Robert Rodriguez Salma Hayek Action Adventure Comedy Family Sci-Fi Sylvester Stallone Alexa PenaVega
1192,Joel Schumacher,Matthew McConaughey,Crime Drama Thriller,Kevin Spacey,A Time to Kill,Oliver Platt,Joel Schumacher Matthew McConaughey Crime Drama Thriller Kevin Spacey Oliver Platt
1193,Shawn Levy,Alyson Stoner,Comedy Family,Tom Welling,Cheaper by the Dozen,Bonnie Hunt,Shawn Levy Alyson Stoner Comedy Family Tom Welling Bonnie Hunt
1194,Peter Berg,Scott Elrod,Action Biography Drama Thriller War,Jerry Ferrara,Lone Survivor,Dan Bilzerian,Peter Berg Scott Elrod Action Biography Drama Thriller War Jerry Ferrara Dan Bilzerian
1195,Penny Marshall,Lori Petty,Comedy Drama Sport,Tom Hanks,A League of Their Own,Rosie O'Donnell,Penny Marshall Lori Petty Comedy Drama Sport Tom Hanks Rosie O'Donnell
1196,James Wan,Frances O'Connor,Horror Mystery Thriller,Javier Botet,The Conjuring 2,Robin Atkin Downes,James Wan Frances O'Connor Horror Mystery Thriller Javier Botet Robin Atkin Downes
1197,David Fincher,Dustin Fitzsimons,Biography Drama,Andrew Garfield,The Social Network,Marcella Lentz-Pope,David Fincher Dustin Fitzsimons Biography Drama Andrew Garfield Marcella Lentz-Pope
1198,Ken Kwapis,Sabrina Revelle,Comedy Drama Romance,Carmen Perez,He's Just Not That Into You,Sachiko Ishida,Ken Kwapis Sabrina Revelle Comedy Drama Romance Carmen Perez Sachiko Ishida
1199,David Zucker,Carmen Electra,Comedy,Beau Mirchoff,Scary Movie 4,Regina Hall,David Zucker Carmen Electra Comedy Beau Mirchoff Regina Hall
1200,Wes Craven,Roger Jackson,Horror Mystery,Kelly Rutherford,Scream 3,Nancy O'Dell,Wes Craven Roger Jackson Horror Mystery Kelly Rutherford Nancy O'Dell
1201,Robert Zemeckis,Jeffrey Weissman,Adventure Comedy Sci-Fi Western,Lea Thompson,Back to the Future Part III,Thomas F. Wilson,Robert Zemeckis Jeffrey Weissman Adventure Comedy Sci-Fi Western Lea Thompson Thomas F. Wilson
1202,Etan Cohen,Alison Brie,Comedy Crime,Will Ferrell,Get Hard,Craig T. Nelson,Etan Cohen Alison Brie Comedy Crime Will Ferrell Craig T. Nelson
1203,Francis Ford Coppola,Anthony Hopkins,Fantasy Horror Romance,Keanu Reeves,Bram Stoker's Dracula,Gary Oldman,Francis Ford Coppola Anthony Hopkins Fantasy Horror Romance Keanu Reeves Gary Oldman
1204,Nora Ephron,Mary Lynn Rajskub,Biography Drama Romance,Meryl Streep,Julie & Julia,Vanessa Ferlito,Nora Ephron Mary Lynn Rajskub Biography Drama Romance Meryl Streep Vanessa Ferlito
1205,Brian Helgeland,Christopher Meloni,Biography Drama Sport,Harrison Ford,42,Nicole Beharie,Brian Helgeland Christopher Meloni Biography Drama Sport Harrison Ford Nicole Beharie
1206,Anthony Minghella,Matt Damon,Crime Drama Thriller,Philip Seymour Hoffman,The Talented Mr. Ripley,Jack Davenport,Anthony Minghella Matt Damon Crime Drama Thriller Philip Seymour Hoffman Jack Davenport
1207,Bobby Farrelly,Kathleen Turner,Comedy,Bill Murray,Dumb and Dumber To,Rob Riggle,Bobby Farrelly Kathleen Turner Comedy Bill Murray Rob Riggle
1208,Frank Marshall,Bruce Greenwood,Adventure Drama Family,Paul Walker,Eight Below,Wendy Crewson,Frank Marshall Bruce Greenwood Adventure Drama Family Paul Walker Wendy Crewson
1209,Nancy Meyers,Anne Hathaway,Comedy Drama,Robert De Niro,The Intern,Rene Russo,Nancy Meyers Anne Hathaway Comedy Drama Robert De Niro Rene Russo
1210,Tim Story,Nadine Velazquez,Action Comedy,Olivia Munn,Ride Along 2,Bruce McGill,Tim Story Nadine Velazquez Action Comedy Olivia Munn Bruce McGill
1211,Michael Mann,Terry Kinney,Action Adventure Drama Romance War,Wes Studi,The Last of the Mohicans,Eric Schweig,Michael Mann Terry Kinney Action Adventure Drama Romance War Wes Studi Eric Schweig
1212,Taylor Hackford,Curtis Armstrong,Biography Drama Music,Bokeem Woodbine,Ray,Harry Lennix,Taylor Hackford Curtis Armstrong Biography Drama Music Bokeem Woodbine Harry Lennix
1213,Frank Miller,Powers Boothe,Crime Thriller,Rosario Dawson,Sin City,Jason Douglas,Frank Miller Powers Boothe Crime Thriller Rosario Dawson Jason Douglas
1214,Pete Travis,Edgar Ramírez,Crime Drama Mystery Thriller,Dennis Quaid,Vantage Point,William Hurt,Pete Travis Edgar Ramírez Crime Drama Mystery Thriller Dennis Quaid William Hurt
1215,John Hamburg,Jon Favreau,Comedy Romance,J.K. Simmons,"I Love You, Man",Jane Curtin,John Hamburg Jon Favreau Comedy Romance J.K. Simmons Jane Curtin
1216,Bobby Farrelly,Bruce McGill,Comedy Drama Fantasy Romance,Jason Alexander,Shallow Hal,Susan Ward,Bobby Farrelly Bruce McGill Comedy Drama Fantasy Romance Jason Alexander Susan Ward
1217,Oliver Stone,Jay O. Sanders,Drama History Thriller,Sally Kirkland,JFK,Cheryl Penland,Oliver Stone Jay O. Sanders Drama History Thriller Sally Kirkland Cheryl Penland
1218,John Whitesell,Nia Long,Comedy Crime,Chloë Grace Moretz,Big Momma's House 2,Marisol Nichols,John Whitesell Nia Long Comedy Crime Chloë Grace Moretz Marisol Nichols
1219,Gore Verbinski,Brad Pitt,Adventure Comedy Crime Romance,J.K. Simmons,The Mexican,Julia Roberts,Gore Verbinski Brad Pitt Adventure Comedy Crime Romance J.K. Simmons Julia Roberts
1220,Angelina Jolie Pitt,Jack O'Connell,Biography Drama Sport War,Finn Wittrock,Unbroken,Alex Russell,Angelina Jolie Pitt Jack O'Connell Biography Drama Sport War Finn Wittrock Alex Russell
1221,Burr Steers,Hunter Parrish,Comedy Drama Family Fantasy Romance,Matthew Perry,17 Again,Thomas Lennon,Burr Steers Hunter Parrish Comedy Drama Family Fantasy Romance Matthew Perry Thomas Lennon
1222,Nick Cassavetes,Kate Upton,Comedy Romance,Don Johnson,The Other Woman,David Thornton,Nick Cassavetes Kate Upton Comedy Romance Don Johnson David Thornton
1223,David R. Ellis,Andrew Fiscella,Horror,Krista Allen,The Final Destination,Shantel VanSanten,David R. Ellis Andrew Fiscella Horror Krista Allen Shantel VanSanten
1224,Steven Spielberg,Mark Rylance,Drama History Thriller,Tom Hanks,Bridge of Spies,Amy Ryan,Steven Spielberg Mark Rylance Drama History Thriller Tom Hanks Amy Ryan
1225,John Moore,David Keith,Action Drama Thriller War,Joaquim de Almeida,Behind Enemy Lines,Sam Jaeger,John Moore David Keith Action Drama Thriller War Joaquim de Almeida Sam Jaeger
1226,Nicholas Stoller,Mario Lopez,Comedy Music,Pink,Get Him to the Greek,Lino Facioli,Nicholas Stoller Mario Lopez Comedy Music Pink Lino Facioli
1227,Peter Chelsom,Nick Cannon,Comedy Drama Romance,Lisa Ann Walter,Shall We Dance,Omar Benson Miller,Peter Chelsom Nick Cannon Comedy Drama Romance Lisa Ann Walter Omar Benson Miller
1228,Joe Dante,Denis Leary,Action Adventure Comedy Family Sci-Fi,Kirsten Dunst,Small Soldiers,Robert Picardo,Joe Dante Denis Leary Action Adventure Comedy Family Sci-Fi Kirsten Dunst Robert Picardo
1229,Mark A.Z. Dippé,Frank Welker,Action Horror,Michael Jai White,Spawn,Miko Hughes,Mark A.Z. Dippé Frank Welker Action Horror Michael Jai White Miko Hughes
1230,Kevin Reynolds,James Frain,Action Adventure Drama Romance Thriller,Henry Cavill,The Count of Monte Cristo,Michael Wincott,Kevin Reynolds James Frain Action Adventure Drama Romance Thriller Henry Cavill Michael Wincott
1231,Brad Furman,Margarita Levieva,Crime Drama Thriller,Matthew McConaughey,The Lincoln Lawyer,Frances Fisher,Brad Furman Margarita Levieva Crime Drama Thriller Matthew McConaughey Frances Fisher
1232,Jaume Collet-Serra,Frank Langella,Action Mystery Thriller,Liam Neeson,Unknown,Aidan Quinn,Jaume Collet-Serra Frank Langella Action Mystery Thriller Liam Neeson Aidan Quinn
1233,Christopher Nolan,Hugh Jackman,Drama Mystery Sci-Fi Thriller,Christian Bale,The Prestige,Scarlett Johansson,Christopher Nolan Hugh Jackman Drama Mystery Sci-Fi Thriller Christian Bale Scarlett Johansson
1234,Sean Anders,Christoph Waltz,Comedy Crime,Kevin Spacey,Horrible Bosses 2,Lindsay Sloane,Sean Anders Christoph Waltz Comedy Crime Kevin Spacey Lindsay Sloane
1235,Cal Brunker,Paul Scheer,Adventure Animation Comedy Family Sci-Fi,Brendan Fraser,Escape from Planet Earth,Jonathan Morgan Heit,Cal Brunker Paul Scheer Adventure Animation Comedy Family Sci-Fi Brendan Fraser Jonathan Morgan Heit
1236,Mel Gibson,Dalia Hernández,Action Adventure Drama Thriller,Rudy Youngblood,Apocalypto,Jonathan Brewer,Mel Gibson Dalia Hernández Action Adventure Drama Thriller Rudy Youngblood Jonathan Brewer
1237,John Glen,Desmond Llewelyn,Action Adventure Thriller,Joe Don Baker,The Living Daylights,Art Malik,John Glen Desmond Llewelyn Action Adventure Thriller Joe Don Baker Art Malik
1238,Nimród Antal,Alice Braga,Action Adventure Sci-Fi Thriller,Topher Grace,Predators,Derek Mears,Nimród Antal Alice Braga Action Adventure Sci-Fi Thriller Topher Grace Derek Mears
1239,Ivan Reitman,Debra Winger,Comedy Crime Romance,Brian Dennehy,Legal Eagles,Roscoe Lee Browne,Ivan Reitman Debra Winger Comedy Crime Romance Brian Dennehy Roscoe Lee Browne
1240,David Koepp,Charles S. Dutton,Mystery Thriller,Johnny Depp,Secret Window,Timothy Hutton,David Koepp Charles S. Dutton Mystery Thriller Johnny Depp Timothy Hutton
1241,Alejandro Agresti,Dylan Walsh,Drama Fantasy Romance,Keanu Reeves,The Lake House,Ebon Moss-Bachrach,Alejandro Agresti Dylan Walsh Drama Fantasy Romance Keanu Reeves Ebon Moss-Bachrach
1242,Iain Softley,Deneen Tyler,Horror Mystery Thriller,Gena Rowlands,The Skeleton Key,Joy Bryant,Iain Softley Deneen Tyler Horror Mystery Thriller Gena Rowlands Joy Bryant
1243,Peter Hedges,Odeya Rush,Comedy Drama Family Fantasy,Jennifer Garner,The Odd Life of Timothy Green,Common,Peter Hedges Odeya Rush Comedy Drama Family Fantasy Jennifer Garner Common
1244,Paul Weiland,Beau Garrett,Comedy Romance,Busy Philipps,Made of Honor,Kevin Sussman,Paul Weiland Beau Garrett Comedy Romance Busy Philipps Kevin Sussman
1245,Clint Eastwood,Steve Schirripa,Biography Drama Music Musical,Johnny Cannizzaro,Jersey Boys,Scott Vance,Clint Eastwood Steve Schirripa Biography Drama Music Musical Johnny Cannizzaro Scott Vance
1246,Francis Ford Coppola,Dean Stockwell,Crime Drama Thriller,Matt Damon,The Rainmaker,Virginia Madsen,Francis Ford Coppola Dean Stockwell Crime Drama Thriller Matt Damon Virginia Madsen
1247,Mathieu Kassovitz,Charles S. Dutton,Horror Mystery Thriller,Robert Downey Jr.,Gothika,Bernard Hill,Mathieu Kassovitz Charles S. Dutton Horror Mystery Thriller Robert Downey Jr. Bernard Hill
1248,Steven Spielberg,Morgan Freeman,Drama History,Anthony Hopkins,Amistad,Matthew McConaughey,Steven Spielberg Morgan Freeman Drama History Anthony Hopkins Matthew McConaughey
1249,John McTiernan,José Wilker,Adventure Drama Romance,Lorraine Bracco,Medicine Man,Sean Connery,John McTiernan José Wilker Adventure Drama Romance Lorraine Bracco Sean Connery
1250,Colin Strause,Johnny Lewis,Action Horror Sci-Fi Thriller,Sam Trammell,Aliens vs. Predator: Requiem,Ian Whyte,Colin Strause Johnny Lewis Action Horror Sci-Fi Thriller Sam Trammell Ian Whyte
1251,Donald Petrie,John Larroquette,Comedy Family,Macaulay Culkin,Ri¢hie Ri¢h,Jonathan Hyde,Donald Petrie John Larroquette Comedy Family Macaulay Culkin Jonathan Hyde
1252,Joan Chen,Sam Trammell,Drama Romance,J.K. Simmons,Autumn in New York,Elaine Stritch,Joan Chen Sam Trammell Drama Romance J.K. Simmons Elaine Stritch
1253,Marc Lawrence,Scott Porter,Comedy Music Romance,Brad Garrett,Music and Lyrics,Haley Bennett,Marc Lawrence Scott Porter Comedy Music Romance Brad Garrett Haley Bennett
1254,Greg Mottola,Nelson Ascencio,Adventure Comedy Sci-Fi,Bobby Lee,Paul,Jeremy Owen,Greg Mottola Nelson Ascencio Adventure Comedy Sci-Fi Bobby Lee Jeremy Owen
1255,Anne Fletcher,Tom Virtue,Comedy Drama,Miriam Margolyes,The Guilt Trip,Julene Renee,Anne Fletcher Tom Virtue Comedy Drama Miriam Margolyes Julene Renee
1256,Wes Craven,Aimee Teegarden,Horror Mystery,Alison Brie,Scream 4,Shenae Grimes-Beech,Wes Craven Aimee Teegarden Horror Mystery Alison Brie Shenae Grimes-Beech
1257,Joel Schumacher,Chris Bauer,Mystery Thriller,Nicolas Cage,8MM,Anthony Heald,Joel Schumacher Chris Bauer Mystery Thriller Nicolas Cage Anthony Heald
1258,Oliver Stone,Kevin Dillon,Biography Drama Music Musical,Michael Wincott,The Doors,Kathleen Quinlan,Oliver Stone Kevin Dillon Biography Drama Music Musical Michael Wincott Kathleen Quinlan
1259,Jake Kasdan,Randall Park,Comedy,James Wilcox,Sex Tape,Nat Faxon,Jake Kasdan Randall Park Comedy James Wilcox Nat Faxon
1260,Diane Keaton,Celia Weston,Comedy Drama,Adam Arkin,Hanging Up,Jesse James,Diane Keaton Celia Weston Comedy Drama Adam Arkin Jesse James
1261,Steven Quale,Jacqueline MacInnes Wood,Horror,Emma Bell,Final Destination 5,Courtney B. Vance,Steven Quale Jacqueline MacInnes Wood Horror Emma Bell Courtney B. Vance
1262,Kelly Makin,Burt Young,Comedy Crime Romance,Jeanne Tripplehorn,Mickey Blue Eyes,Vincent Pastore,Kelly Makin Burt Young Comedy Crime Romance Jeanne Tripplehorn Vincent Pastore
1263,Mimi Leder,Haley Joel Osment,Drama,Kevin Spacey,Pay It Forward,Angie Dickinson,Mimi Leder Haley Joel Osment Drama Kevin Spacey Angie Dickinson
1264,Bobby Farrelly,KaDee Strickland,Comedy Drama Romance Sport,Jimmy Fallon,Fever Pitch,Ione Skye,Bobby Farrelly KaDee Strickland Comedy Drama Romance Sport Jimmy Fallon Ione Skye
1266,Steven Brill,Shaun Weiss,Comedy Drama,Lisa Ann Walter,Drillbit Taylor,Matt Walsh,Steven Brill Shaun Weiss Comedy Drama Lisa Ann Walter Matt Walsh
1267,Seth MacFarlane,Charlize Theron,Comedy Western,Liam Neeson,A Million Ways to Die in the West,Seth MacFarlane,Seth MacFarlane Charlize Theron Comedy Western Liam Neeson Seth MacFarlane
1268,Russell Mulcahy,Peter Boyle,Action Adventure Crime Fantasy Mystery Thriller,Jonathan Winters,The Shadow,John Kapelos,Russell Mulcahy Peter Boyle Action Adventure Crime Fantasy Mystery Thriller Jonathan Winters John Kapelos
1269,Stephen Daldry,Thomas Horn,Adventure Drama Mystery,Tom Hanks,Extremely Loud & Incredibly Close,Stephen Henderson,Stephen Daldry Thomas Horn Adventure Drama Mystery Tom Hanks Stephen Henderson
1270,Roger Michell,Patti D'Arbanville,Comedy Drama Romance,Noah Bean,Morning Glory,Vanessa Aspillaga,Roger Michell Patti D'Arbanville Comedy Drama Romance Noah Bean Vanessa Aspillaga
1271,Jim Sheridan,Bill Duke,Biography Crime Drama Music,50 Cent,Get Rich or Die Tryin',Marc John Jefferies,Jim Sheridan Bill Duke Biography Crime Drama Music 50 Cent Marc John Jefferies
1272,Christian Duguay,Cary-Hiroyuki Tagawa,Action Adventure Crime Thriller,Michael Biehn,The Art of War,Anne Archer,Christian Duguay Cary-Hiroyuki Tagawa Action Adventure Crime Thriller Michael Biehn Anne Archer
1273,Chris Columbus,David Fine,Drama Musical Romance,Rosario Dawson,Rent,Jesse L. Martin,Chris Columbus David Fine Drama Musical Romance Rosario Dawson Jesse L. Martin
1274,Chuck Russell,Jimmy Smits,Crime Drama Horror Thriller,Rufus Sewell,Bless the Child,Angela Bettis,Chuck Russell Jimmy Smits Crime Drama Horror Thriller Rufus Sewell Angela Bettis
1275,Sam Weisman,Valerie Perri,Comedy,Oliver Hudson,The Out-of-Towners,Carlease Burke,Sam Weisman Valerie Perri Comedy Oliver Hudson Carlease Burke
1276,John Frankenheimer,Temuera Morrison,Horror Sci-Fi Thriller,Marlon Brando,The Island of Dr. Moreau,Marco Hofschneider,John Frankenheimer Temuera Morrison Horror Sci-Fi Thriller Marlon Brando Marco Hofschneider
