,director_name,actor_2_name,genres,actor_1_name,movie_title,actor_3_name,combined
3682,Aki Kaurismäki,Kati Outinen,Comedy Drama,Jean-Pierre Léaud,Le Havre,Jean-Pierre Darroussin,Aki Kaurismäki Kati Outinen Comedy Drama Jean-Pierre Léaud Jean-Pierre Darroussin
3683,Gaspar Noé,Albert Dupontel,Crime Drama Mystery Thriller,Philippe Nahon,Irreversible,Jo Prestia,Gaspar Noé Albert Dupontel Crime Drama Mystery Thriller Philippe Nahon Jo Prestia
3684,Hitoshi Matsumoto,Hitoshi Matsumoto,Comedy Drama,Lindsay Kay Hayward,R100,Shinobu Terajima,Hitoshi Matsumoto Hitoshi Matsumoto Comedy Drama Lindsay Kay Hayward Shinobu Terajima
3685,Rakeysh Omprakash Mehra,Steven Mackintosh,Comedy Drama History Romance,Anupam Kher,Rang De Basanti,Madhavan,Rakeysh Omprakash Mehra Steven Mackintosh Comedy Drama History Romance Anupam Kher Madhavan
3686,Collin Schiffli,John Heard,Drama,Kim Shaw,Animals,David Dastmalchian,Collin Schiffli John Heard Drama Kim Shaw David Dastmalchian
3687,George Ratliff,Cree Kelly,Action Comedy Drama Thriller,Jim Gaffigan,Salvation Boulevard,Mike Eshaq,George Ratliff Cree Kelly Action Comedy Drama Thriller Jim Gaffigan Mike Eshaq
3688,David Wain,Ken Marino,Comedy Romance,Jon Hamm,The Ten,Ron Silver,David Wain Ken Marino Comedy Romance Jon Hamm Ron Silver
3689,Shane Meadows,Paddy Considine,Comedy Drama,Bob Hoskins,A Room for Romeo Brass,Shane Meadows,Shane Meadows Paddy Considine Comedy Drama Bob Hoskins Shane Meadows
3690,Morten Tyldum,Synnøve Macody Lund,Crime Drama Thriller,Aksel Hennie,Headhunters,Julie R. Ølgaard,Morten Tyldum Synnøve Macody Lund Crime Drama Thriller Aksel Hennie Julie R. Ølgaard
3691,Jon Wright,Richard Coyle,Comedy Horror Sci-Fi Thriller,Russell Tovey,Grabbers,Bronagh Gallagher,Jon Wright Richard Coyle Comedy Horror Sci-Fi Thriller Russell Tovey Bronagh Gallagher
3692,Michael McGowan,Adam Butcher,Comedy Drama Sport,Campbell Scott,Saint Ralph,Gordon Pinsent,Michael McGowan Adam Butcher Comedy Drama Sport Campbell Scott Gordon Pinsent
3693,Liv Ullmann,Jessica Chastain,Drama Romance,Samantha Morton,Miss Julie,Colin Farrell,Liv Ullmann Jessica Chastain Drama Romance Samantha Morton Colin Farrell
3694,Jeannot Szwarc,Bill Erwin,Drama Fantasy Romance,Teresa Wright,Somewhere in Time,George Voskovec,Jeannot Szwarc Bill Erwin Drama Fantasy Romance Teresa Wright George Voskovec
3695,Rohan Sippy,Bipasha Basu,Action Crime Drama Thriller,Abhishek Bachchan,Dum Maaro Dum,Prateik,Rohan Sippy Bipasha Basu Action Crime Drama Thriller Abhishek Bachchan Prateik
3696,James Wan,Barbara Hershey,Fantasy Horror Thriller,Lin Shaye,Insidious: Chapter 2,Leigh Whannell,James Wan Barbara Hershey Fantasy Horror Thriller Lin Shaye Leigh Whannell
3697,Darren Lynn Bousman,Tony Nappo,Horror Mystery,Emmanuelle Vaugier,Saw II,Shawnee Smith,Darren Lynn Bousman Tony Nappo Horror Mystery Emmanuelle Vaugier Shawnee Smith
3698,Dan Trachtenberg,John Gallagher Jr.,Drama Horror Mystery Sci-Fi Thriller,Bradley Cooper,10 Cloverfield Lane,Sumalee Montano,Dan Trachtenberg John Gallagher Jr. Drama Horror Mystery Sci-Fi Thriller Bradley Cooper Sumalee Montano
3699,Jeff Tremaine,Steve-O,Comedy Documentary,Bam Margera,Jackass: The Movie,Chris Pontius,Jeff Tremaine Steve-O Comedy Documentary Bam Margera Chris Pontius
3700,David F. Sandberg,Amiah Miller,Horror,Billy Burke,Lights Out,Gabriel Bateman,David F. Sandberg Amiah Miller Horror Billy Burke Gabriel Bateman
3701,Henry Joost,Sprague Grayden,Horror,Johanna Braddy,Paranormal Activity 3,Christopher Nicholas Smith,Henry Joost Sprague Grayden Horror Johanna Braddy Christopher Nicholas Smith
3702,Stiles White,Shelley Hennig,Fantasy Horror,Lin Shaye,Ouija,Daren Kagasoff,Stiles White Shelley Hennig Fantasy Horror Lin Shaye Daren Kagasoff
3703,Chuck Russell,Heather Langenkamp,Action Fantasy Horror Thriller,John Saxon,A Nightmare on Elm Street 3: Dream Warriors,Jennifer Rubin,Chuck Russell Heather Langenkamp Action Fantasy Horror Thriller John Saxon Jennifer Rubin
3704,Joel Edgerton,Allison Tolman,Mystery Thriller,Busy Philipps,The Gift,Wendell Pierce,Joel Edgerton Allison Tolman Mystery Thriller Busy Philipps Wendell Pierce
3705,Eugenio Derbez,Jessica Lindsey,Comedy Drama,Eugenio Derbez,Instructions Not Included,Hugo Stiglitz,Eugenio Derbez Jessica Lindsey Comedy Drama Eugenio Derbez Hugo Stiglitz
3706,Henry Joost,Brendon Eggertsen,Horror,Matt Shively,Paranormal Activity 4,Alisha Boe,Henry Joost Brendon Eggertsen Horror Matt Shively Alisha Boe
3707,Henry Koster,Jean Simmons,Drama History,Richard Burton,The Robe,Victor Mature,Henry Koster Jean Simmons Drama History Richard Burton Victor Mature
3708,Blake Edwards,Herbert Lom,Comedy Crime Mystery,Burt Kwouk,The Return of the Pink Panther,Catherine Schell,Blake Edwards Herbert Lom Comedy Crime Mystery Burt Kwouk Catherine Schell
3709,Rachel Talalay,Tom Arnold,Comedy Fantasy Horror Thriller,Johnny Depp,Freddy's Dead: The Final Nightmare,Yaphet Kotto,Rachel Talalay Tom Arnold Comedy Fantasy Horror Thriller Johnny Depp Yaphet Kotto
3710,Patty Jenkins,Bruce Dern,Biography Crime Drama Thriller,Charlize Theron,Monster,Pruitt Taylor Vince,Patty Jenkins Bruce Dern Biography Crime Drama Thriller Charlize Theron Pruitt Taylor Vince
3711,Richard Fleischer,Robert J. Wilke,Adventure Drama Family Fantasy Sci-Fi,James Mason,"20,000 Leagues Under the Sea",Paul Lukas,Richard Fleischer Robert J. Wilke Adventure Drama Family Fantasy Sci-Fi James Mason Paul Lukas
3712,Christopher Landon,Gloria Sandoval,Fantasy Horror Thriller,Richard Cabral,Paranormal Activity: The Marked Ones,Molly Ephraim,Christopher Landon Gloria Sandoval Fantasy Horror Thriller Richard Cabral Molly Ephraim
3713,David Lynch,Anne Bancroft,Biography Drama,Anthony Hopkins,The Elephant Man,Dexter Fletcher,David Lynch Anne Bancroft Biography Drama Anthony Hopkins Dexter Fletcher
3714,Jean-Marc Vallée,Jennifer Garner,Biography Drama,Matthew McConaughey,Dallas Buyers Club,Denis O'Hare,Jean-Marc Vallée Jennifer Garner Biography Drama Matthew McConaughey Denis O'Hare
3715,David Gelb,Mark Duplass,Horror Sci-Fi Thriller,Olivia Wilde,The Lazarus Effect,Donald Glover,David Gelb Mark Duplass Horror Sci-Fi Thriller Olivia Wilde Donald Glover
3716,Christopher Nolan,Thomas Lennon,Mystery Thriller,Callum Rennie,Memento,Jorja Fox,Christopher Nolan Thomas Lennon Mystery Thriller Callum Rennie Jorja Fox
3717,Mike Flanagan,Rory Cochrane,Horror Mystery,James Lafferty,Oculus,Garrett Ryan,Mike Flanagan Rory Cochrane Horror Mystery James Lafferty Garrett Ryan
3718,Kevin Smith,Jason Mewes,Comedy,Ethan Suplee,Clerks II,Brian O'Halloran,Kevin Smith Jason Mewes Comedy Ethan Suplee Brian O'Halloran
3719,Stephen Daldry,Gary Lewis,Drama Music,Julie Walters,Billy Elliot,Jamie Draven,Stephen Daldry Gary Lewis Drama Music Julie Walters Jamie Draven
3720,Nat Faxon,Liam James,Comedy Drama,Steve Carell,The Way Way Back,Jim Rash,Nat Faxon Liam James Comedy Drama Steve Carell Jim Rash
3721,George Jackson,Tisha Campbell-Martin,Comedy Drama Music Romance,William Schallert,House Party 2,Helen Martin,George Jackson Tisha Campbell-Martin Comedy Drama Music Romance William Schallert Helen Martin
3722,George Miller,Jack Thompson,Adventure Drama Family Romance Western,Tony Bonner,The Man from Snowy River,Tom Burlinson,George Miller Jack Thompson Adventure Drama Family Romance Western Tony Bonner Tom Burlinson
3723,Maurice Joyce,Constance Shulman,Animation Comedy Family,Frank Welker,Doug's 1st Movie,Alice Playten,Maurice Joyce Constance Shulman Animation Comedy Family Frank Welker Alice Playten
3724,Robert Duvall,Todd Allen,Drama,John Beasley,The Apostle,June Carter Cash,Robert Duvall Todd Allen Drama John Beasley June Carter Cash
3725,Frank Perry,Xander Berkeley,Biography Drama,Faye Dunaway,Mommie Dearest,Diana Scarwid,Frank Perry Xander Berkeley Biography Drama Faye Dunaway Diana Scarwid
3726,Jesse Peretz,Adam Scott,Comedy Drama,Zooey Deschanel,Our Idiot Brother,Steve Coogan,Jesse Peretz Adam Scott Comedy Drama Zooey Deschanel Steve Coogan
3727,Stephen Hopkins,Tony Curran,Biography Drama Sport,William Hurt,Race,David Kross,Stephen Hopkins Tony Curran Biography Drama Sport William Hurt David Kross
3728,Ice Cube,Monica Calhoun,Comedy Drama,Bernie Mac,The Players Club,Chrystale Wilson,Ice Cube Monica Calhoun Comedy Drama Bernie Mac Chrystale Wilson
3729,Tim Blake Nelson,Andrew Keegan,Drama Romance Thriller,Mekhi Phifer,O,John Heard,Tim Blake Nelson Andrew Keegan Drama Romance Thriller Mekhi Phifer John Heard
3730,John Erick Dowdle,Edwin Hodge,Horror Mystery Thriller,Ben Feldman,"As Above, So Below",Perdita Weeks,John Erick Dowdle Edwin Hodge Horror Mystery Thriller Ben Feldman Perdita Weeks
3731,Bille Woodruff,Cameron Mills,Drama Thriller,Boris Kodjoe,Addicted,Sharon Leal,Bille Woodruff Cameron Mills Drama Thriller Boris Kodjoe Sharon Leal
3732,Kasi Lemmons,Lynn Whitfield,Drama,Jurnee Smollett-Bell,Eve's Bayou,Diahann Carroll,Kasi Lemmons Lynn Whitfield Drama Jurnee Smollett-Bell Diahann Carroll
3733,Richard Glatzer,Hunter Parrish,Drama,Kristen Stewart,Still Alice,Seth Gilliam,Richard Glatzer Hunter Parrish Drama Kristen Stewart Seth Gilliam
3734,Michael Curtiz,Peter Ustinov,Drama History,Gene Tierney,The Egyptian,Jean Simmons,Michael Curtiz Peter Ustinov Drama History Gene Tierney Jean Simmons
3735,Bruce Malmuth,Lindsay Wagner,Action Crime Thriller,Sylvester Stallone,Nighthawks,Persis Khambatta,Bruce Malmuth Lindsay Wagner Action Crime Thriller Sylvester Stallone Persis Khambatta
3736,Rob Hedden,Peter Mark Richman,Adventure Horror,Kane Hodder,Friday the 13th Part VIII: Jason Takes Manhattan,Scott Reeves,Rob Hedden Peter Mark Richman Adventure Horror Kane Hodder Scott Reeves
3737,Joel Zwick,Louis Mandylor,Comedy Family Romance,Nia Vardalos,My Big Fat Greek Wedding,Lainie Kazan,Joel Zwick Louis Mandylor Comedy Family Romance Nia Vardalos Lainie Kazan
3738,Harmony Korine,Heather Morris,Crime Drama,James Franco,Spring Breakers,Rachel Korine,Harmony Korine Heather Morris Crime Drama James Franco Rachel Korine
3739,Joe Chappelle,Kim Darby,Horror Thriller,Donald Pleasence,Halloween: The Curse of Michael Myers,Mitchell Ryan,Joe Chappelle Kim Darby Horror Thriller Donald Pleasence Mitchell Ryan
3740,Alfonso Cuarón,Daniel Giménez Cacho,Adventure Comedy Drama Romance,Maribel Verdú,Y Tu Mamá También,María Aura,Alfonso Cuarón Daniel Giménez Cacho Adventure Comedy Drama Romance Maribel Verdú María Aura
3741,Edgar Wright,Dylan Moran,Comedy Horror,Peter Serafinowicz,Shaun of the Dead,Rafe Spall,Edgar Wright Dylan Moran Comedy Horror Peter Serafinowicz Rafe Spall
3742,Mickey Liddell,Randy Wayne,Drama Horror Thriller,Jessica Lowndes,The Haunting of Molly Hartley,Haley Bennett,Mickey Liddell Randy Wayne Drama Horror Thriller Jessica Lowndes Haley Bennett
3743,John Sayles,Clifton James,Drama Mystery,Matthew McConaughey,Lone Star,Miriam Colon,John Sayles Clifton James Drama Mystery Matthew McConaughey Miriam Colon
3744,Dwight H. Little,Kathleen Kinmont,Horror Thriller,Donald Pleasence,Halloween 4: The Return of Michael Myers,Ellie Cornell,Dwight H. Little Kathleen Kinmont Horror Thriller Donald Pleasence Ellie Cornell
3745,Fred Walton,Deborah Foreman,Horror Mystery,Thomas F. Wilson,April Fool's Day,Clayton Rohner,Fred Walton Deborah Foreman Horror Mystery Thomas F. Wilson Clayton Rohner
3746,Barry Levinson,Daniel Stern,Comedy Drama,Steve Guttenberg,Diner,Ellen Barkin,Barry Levinson Daniel Stern Comedy Drama Steve Guttenberg Ellen Barkin
3747,Steve Carver,William Sanderson,Action Crime Drama Thriller Western,David Carradine,Lone Wolf McQuade,Robert Beltran,Steve Carver William Sanderson Action Crime Drama Thriller Western David Carradine Robert Beltran
3748,Gonzalo López-Gallego,Ryan Robbins,Horror Mystery Sci-Fi Thriller,Warren Christie,Apollo 18,Andrew Airlie,Gonzalo López-Gallego Ryan Robbins Horror Mystery Sci-Fi Thriller Warren Christie Andrew Airlie
3749,Christine Jeffs,Mary Lynn Rajskub,Comedy Drama,Clifton Collins Jr.,Sunshine Cleaning,Paul Dooley,Christine Jeffs Mary Lynn Rajskub Comedy Drama Clifton Collins Jr. Paul Dooley
3750,John Erick Dowdle,Claire Geare,Action Thriller,Sterling Jerins,No Escape,Sahajak Boonthanakit,John Erick Dowdle Claire Geare Action Thriller Sterling Jerins Sahajak Boonthanakit
3751,Don Coscarelli,John Amos,Action Adventure Fantasy,Vanna Bonta,The Beastmaster,Rip Torn,Don Coscarelli John Amos Action Adventure Fantasy Vanna Bonta Rip Torn
3752,King Vidor,George Sanders,Drama History Romance War,Gina Lollobrigida,Solomon and Sheba,Finlay Currie,King Vidor George Sanders Drama History Romance War Gina Lollobrigida Finlay Currie
3753,Michael Tiddes,Mike Epps,Comedy,Fred Willard,Fifty Shades of Black,Russell Peters,Michael Tiddes Mike Epps Comedy Fred Willard Russell Peters
3754,Bill Duke,Jenifer Lewis,Drama Romance,Eddie Cibrian,Not Easily Broken,Wood Harris,Bill Duke Jenifer Lewis Drama Romance Eddie Cibrian Wood Harris
3755,Frank Borzage,Helen Hayes,Drama Romance War,Gary Cooper,A Farewell to Arms,Adolphe Menjou,Frank Borzage Helen Hayes Drama Romance War Gary Cooper Adolphe Menjou
3756,Bille Woodruff,Brandy Norwood,Comedy Romance,Donald Faison,The Perfect Match,Lauren London,Bille Woodruff Brandy Norwood Comedy Romance Donald Faison Lauren London
3757,Mamoru Hosoda,Colleen O'Shaughnessey,Action Adventure Animation Family Sci-Fi,Lara Jill Miller,Digimon: The Movie,Mona Marshall,Mamoru Hosoda Colleen O'Shaughnessey Action Adventure Animation Family Sci-Fi Lara Jill Miller Mona Marshall
3758,Brian Dannelly,Patrick Fugit,Comedy Drama,Macaulay Culkin,Saved!,Eva Amurri Martino,Brian Dannelly Patrick Fugit Comedy Drama Macaulay Culkin Eva Amurri Martino
3759,Denys Arcand,Stéphane Rousseau,Comedy Crime Drama Mystery Romance,Marie-Josée Croze,The Barbarian Invasions,Marina Hands,Denys Arcand Stéphane Rousseau Comedy Crime Drama Mystery Romance Marie-Josée Croze Marina Hands
3760,Richard Lester,Denholm Elliott,Adventure Drama Romance,Robert Shaw,Robin and Marian,Nicol Williamson,Richard Lester Denholm Elliott Adventure Drama Romance Robert Shaw Nicol Williamson
3761,J.S. Cardone,Kerr Smith,Horror Thriller,Brendan Fehr,The Forsaken,Izabella Miko,J.S. Cardone Kerr Smith Horror Thriller Brendan Fehr Izabella Miko
3762,Guy Hamilton,Carl Weathers,Action Drama War,Harrison Ford,Force 10 from Navarone,Franco Nero,Guy Hamilton Carl Weathers Action Drama War Harrison Ford Franco Nero
3763,Jay Levey,Gedde Watanabe,Comedy Drama,Fran Drescher,UHF,Michael Richards,Jay Levey Gedde Watanabe Comedy Drama Fran Drescher Michael Richards
3764,Nicholaus Goossen,Joel David Moore,Comedy,Linda Cardellini,Grandma's Boy,Shirley Jones,Nicholaus Goossen Joel David Moore Comedy Linda Cardellini Shirley Jones
3765,Tamara Jenkins,Kevin Corrigan,Comedy Drama,Natasha Lyonne,Slums of Beverly Hills,Jessica Walter,Tamara Jenkins Kevin Corrigan Comedy Drama Natasha Lyonne Jessica Walter
3766,Sergio Leone,Woody Strode,Western,Claudia Cardinale,Once Upon a Time in the West,Jack Elam,Sergio Leone Woody Strode Western Claudia Cardinale Jack Elam
3767,Jon Favreau,Faizon Love,Comedy Crime Drama Thriller,Jon Favreau,Made,Jonathan Silverman,Jon Favreau Faizon Love Comedy Crime Drama Thriller Jon Favreau Jonathan Silverman
3768,Duncan Jones,Matt Berry,Drama Mystery Sci-Fi,Kevin Spacey,Moon,Benedict Wong,Duncan Jones Matt Berry Drama Mystery Sci-Fi Kevin Spacey Benedict Wong
3769,Scott Marshall,Jami Gertz,Comedy,Miranda Cosgrove,Keeping Up with the Steins,Carter Jenkins,Scott Marshall Jami Gertz Comedy Miranda Cosgrove Carter Jenkins
3770,Ronan Chapalain,Guillaume Denaiffe,Documentary,Norbert Ferrer,Sea Rex 3D: Journey to a Prehistoric World,Chloe Hollings,Ronan Chapalain Guillaume Denaiffe Documentary Norbert Ferrer Chloe Hollings
3771,Atom Egoyan,Sarah Polley,Drama,Bruce Greenwood,The Sweet Hereafter,Simon Baker,Atom Egoyan Sarah Polley Drama Bruce Greenwood Simon Baker
3772,Xavier Beauvois,Michael Lonsdale,Drama,Lambert Wilson,Of Gods and Men,Olivier Rabourdin,Xavier Beauvois Michael Lonsdale Drama Lambert Wilson Olivier Rabourdin
3773,Randall Miller,Freddy Rodríguez,Comedy Drama,Alan Rickman,Bottle Shock,Greg Collins,Randall Miller Freddy Rodríguez Comedy Drama Alan Rickman Greg Collins
3774,Jerry Belson,Tim Thomerson,Comedy Music Sci-Fi,Cassandra Peterson,Jekyll and Hyde... Together Again,Bess Armstrong,Jerry Belson Tim Thomerson Comedy Music Sci-Fi Cassandra Peterson Bess Armstrong
3775,Peter Jackson,Jed Brophy,Biography Crime Drama Romance Thriller,Kate Winslet,Heavenly Creatures,Liz Mullane,Peter Jackson Jed Brophy Biography Crime Drama Romance Thriller Kate Winslet Liz Mullane
3776,Michael Polish,Bobby Batson,Drama,Hayden Christensen,90 Minutes in Heaven,Cynthia Barrett,Michael Polish Bobby Batson Drama Hayden Christensen Cynthia Barrett
3777,Dan Rush,Scott Takeda,Comedy Drama,Will Ferrell,Everything Must Go,Stephen Root,Dan Rush Scott Takeda Comedy Drama Will Ferrell Stephen Root
3778,Jake Kasdan,Ryan O'Neal,Comedy Crime Drama Mystery Thriller,Kim Dickens,Zero Effect,Angela Featherstone,Jake Kasdan Ryan O'Neal Comedy Crime Drama Mystery Thriller Kim Dickens Angela Featherstone
3779,Brad Anderson,Jennifer Jason Leigh,Drama Thriller,Christian Bale,The Machinist,Reg E. Cathey,Brad Anderson Jennifer Jason Leigh Drama Thriller Christian Bale Reg E. Cathey
3780,Paul Schrader,Jane Adams,Crime Drama,Dana Delany,Light Sleeper,David Clennon,Paul Schrader Jane Adams Crime Drama Dana Delany David Clennon
3781,Michael Cuesta,Paz Vega,Biography Crime Drama Mystery Thriller,Jeremy Renner,Kill the Messenger,Robert Pralgo,Michael Cuesta Paz Vega Biography Crime Drama Mystery Thriller Jeremy Renner Robert Pralgo
3782,John Cameron Mitchell,Jon Tenney,Drama,Dianne Wiest,Rabbit Hole,Tammy Blanchard,John Cameron Mitchell Jon Tenney Drama Dianne Wiest Tammy Blanchard
3783,Fenton Bailey,Mia Kirshner,Biography Crime Drama Thriller,Macaulay Culkin,Party Monster,Marilyn Manson,Fenton Bailey Mia Kirshner Biography Crime Drama Thriller Macaulay Culkin Marilyn Manson
3784,Jeremy Saulnier,Mark Webber,Crime Horror Music Thriller,Alia Shawkat,Green Room,Joe Cole,Jeremy Saulnier Mark Webber Crime Horror Music Thriller Alia Shawkat Joe Cole
3785,Billy Kent,Tim Russ,Comedy Drama Romance,Liza Minnelli,The Oh in Ohio,Winter Ave Zoli,Billy Kent Tim Russ Comedy Drama Romance Liza Minnelli Winter Ave Zoli
3786,James Manera,Greg Germann,Drama Mystery Sci-Fi,Joaquim de Almeida,Atlas Shrugged: Who Is John Galt?,Kristoffer Polaha,James Manera Greg Germann Drama Mystery Sci-Fi Joaquim de Almeida Kristoffer Polaha
3787,Wes Anderson,Darryl Cox,Comedy Crime Drama,Andrew Wilson,Bottle Rocket,Lumi Cavazos,Wes Anderson Darryl Cox Comedy Crime Drama Andrew Wilson Lumi Cavazos
3788,Kevin Spacey,Joe Mantegna,Crime Drama Thriller,Viggo Mortensen,Albino Alligator,Faye Dunaway,Kevin Spacey Joe Mantegna Crime Drama Thriller Viggo Mortensen Faye Dunaway
3789,Feroz Abbas Khan,Bhoomika Chawla,Biography Drama History,Akshaye Khanna,"Gandhi, My Father",Darshan Jariwala,Feroz Abbas Khan Bhoomika Chawla Biography Drama History Akshaye Khanna Darshan Jariwala
3790,Errol Morris,Megan Ambuhl Graner,Crime Documentary War,Jeffrey Frost,Standard Operating Procedure,Ken Davis,Errol Morris Megan Ambuhl Graner Crime Documentary War Jeffrey Frost Ken Davis
3791,Dennis Hopper,Don Gordon,Drama,Raymond Burr,Out of the Blue,Jim Byrnes,Dennis Hopper Don Gordon Drama Raymond Burr Jim Byrnes
3792,Eli Craig,Tyler Labine,Comedy Horror,Katrina Bowden,Tucker and Dale vs Evil,Chelan Simmons,Eli Craig Tyler Labine Comedy Horror Katrina Bowden Chelan Simmons
3793,Nicholas Fackler,Ellen Burstyn,Drama Romance,Adam Scott,"Lovely, Still",Martin Landau,Nicholas Fackler Ellen Burstyn Drama Romance Adam Scott Martin Landau
3794,Richard Wallace,Paul Fix,Adventure Drama Romance,Judith Anderson,Tycoon,Laraine Day,Richard Wallace Paul Fix Adventure Drama Romance Judith Anderson Laraine Day
3795,Morgan J. Freeman,John Heard,Drama,Ethan Suplee,Desert Blue,Sara Gilbert,Morgan J. Freeman John Heard Drama Ethan Suplee Sara Gilbert
3796,Matthew Hastings,Marc Trottier,Comedy Horror Sci-Fi,Meghan Ory,Decoys,Corey Sevier,Matthew Hastings Marc Trottier Comedy Horror Sci-Fi Meghan Ory Corey Sevier
3797,M. Night Shyamalan,Patch Darragh,Horror Thriller,Ocean James,The Visit,Olivia DeJonge,M. Night Shyamalan Patch Darragh Horror Thriller Ocean James Olivia DeJonge
3798,Brian De Palma,Daniel Stewart Sherman,Crime Thriller War,Mike Figueroa,Redacted,Kel O'Neill,Brian De Palma Daniel Stewart Sherman Crime Thriller War Mike Figueroa Kel O'Neill
3799,Klaus Menzel,Jacqueline Bisset,Mystery Romance Thriller,Adam Garcia,Fascination,Alice Evans,Klaus Menzel Jacqueline Bisset Mystery Romance Thriller Adam Garcia Alice Evans
3801,Oren Peli,Sandra Staggs,Horror Sci-Fi Thriller,Glenn Campbell,Area 51,Jelena Nik,Oren Peli Sandra Staggs Horror Sci-Fi Thriller Glenn Campbell Jelena Nik
3802,Jaume Balagueró,Tony Corvillo,Drama Horror Thriller,Luis Tosar,Sleep Tight,Marta Etura,Jaume Balagueró Tony Corvillo Drama Horror Thriller Luis Tosar Marta Etura
3803,Paul Andrew Williams,Doug Bradley,Comedy Crime Horror Thriller,Dave Legeno,The Cottage,Georgia Groome,Paul Andrew Williams Doug Bradley Comedy Crime Horror Thriller Dave Legeno Georgia Groome
3804,Stephen Herek,Callum Blue,Comedy Drama Fantasy,Henry Ian Cusick,Dead Like Me: Life After Death,Shenae Grimes-Beech,Stephen Herek Callum Blue Comedy Drama Fantasy Henry Ian Cusick Shenae Grimes-Beech
3805,Bob Saget,John Stamos,Animation Comedy,Alyson Hannigan,Farce of the Penguins,Jim Belushi,Bob Saget John Stamos Animation Comedy Alyson Hannigan Jim Belushi
3806,Jim Amatulli,Patricia Neal,Drama Family Music,Heather Locklear,Flying By,Katie Leclerc,Jim Amatulli Patricia Neal Drama Family Music Heather Locklear Katie Leclerc
3808,William H. Macy,Felicity Huffman,Comedy Drama Music,Billy Crudup,Rudderless,David Adam Flannery,William H. Macy Felicity Huffman Comedy Drama Music Billy Crudup David Adam Flannery
3809,Barrett Esposito,Cyndi Lauper,Animation Family,Chazz Palminteri,Henry & Me,Danny Aiello,Barrett Esposito Cyndi Lauper Animation Family Chazz Palminteri Danny Aiello
3810,Mitch Davis,Jon Heder,Comedy,Gary Cole,Christmas Eve,Cheryl Hines,Mitch Davis Jon Heder Comedy Gary Cole Cheryl Hines
3811,Eric Bross,Esai Morales,Crime Drama Thriller,Teri Polo,We Have Your Husband,Nicholas Gonzalez,Eric Bross Esai Morales Crime Drama Thriller Teri Polo Nicholas Gonzalez
3812,Paul Schrader,Irène Jacob,Drama Thriller,Nicolas Cage,Dying of the Light,Tomiwa Edun,Paul Schrader Irène Jacob Drama Thriller Nicolas Cage Tomiwa Edun
3813,Vicky Jewson,Sofia Black-D'Elia,Action Drama Thriller War,James Frain,Born of War,Lisa Kay,Vicky Jewson Sofia Black-D'Elia Action Drama Thriller War James Frain Lisa Kay
3814,Peter Hyams,Sam Waterston,Action Sci-Fi Thriller,David Huddleston,Capricorn One,Hal Holbrook,Peter Hyams Sam Waterston Action Sci-Fi Thriller David Huddleston Hal Holbrook
3815,Marc Bennett,Natasha Henstridge,Comedy Drama,Michael Rapaport,Should've Been Romeo,Costas Mandylor,Marc Bennett Natasha Henstridge Comedy Drama Michael Rapaport Costas Mandylor
3816,Mike Mayhall,Cody Howard,Family,David Raizor,Running Forever,Martin Kove,Mike Mayhall Cody Howard Family David Raizor Martin Kove
3817,Kevin Smith,Haley Joel Osment,Comedy Fantasy Horror Thriller,Johnny Depp,Yoga Hosers,Natasha Lyonne,Kevin Smith Haley Joel Osment Comedy Fantasy Horror Thriller Johnny Depp Natasha Lyonne
3818,Stanton Barrett,Michael Dudikoff,Action Horror,Mikal Vega,Navy Seals vs. Zombies,Ed Quinn,Stanton Barrett Michael Dudikoff Action Horror Mikal Vega Ed Quinn
3819,Jirí Menzel,Ivan Barnev,Comedy Drama Romance War,Julia Jentsch,I Served the King of England,Milan Lasica,Jirí Menzel Ivan Barnev Comedy Drama Romance War Julia Jentsch Milan Lasica
3820,Fatih Akin,Moritz Bleibtreu,Comedy Drama,Udo Kier,Soul Kitchen,Birol Ünel,Fatih Akin Moritz Bleibtreu Comedy Drama Udo Kier Birol Ünel
3821,Billy Bob Thornton,Dwight Yoakam,Drama,Robert Duvall,Sling Blade,J.T. Walsh,Billy Bob Thornton Dwight Yoakam Drama Robert Duvall J.T. Walsh
3822,Nick Murphy,Imelda Staunton,Horror Thriller,Isaac Hempstead Wright,The Awakening,Joseph Mawle,Nick Murphy Imelda Staunton Horror Thriller Isaac Hempstead Wright Joseph Mawle
3823,Eli Roth,Takashi Miike,Horror,Jay Hernandez,Hostel,Rick Hoffman,Eli Roth Takashi Miike Horror Jay Hernandez Rick Hoffman
3824,Michael Winterbottom,Shirley Henderson,Comedy Drama,Steve Coogan,Tristram Shandy: A Cock and Bull Story,Dylan Moran,Michael Winterbottom Shirley Henderson Comedy Drama Steve Coogan Dylan Moran
3825,Jeff Nichols,Shea Whigham,Drama Thriller,Katy Mixon,Take Shelter,Robert Longstreet,Jeff Nichols Shea Whigham Drama Thriller Katy Mixon Robert Longstreet
3826,Frank LaLoggia,Lukas Haas,Fantasy Horror Mystery Thriller,Alex Rocco,Lady in White,Katherine Helmond,Frank LaLoggia Lukas Haas Fantasy Horror Mystery Thriller Alex Rocco Katherine Helmond
3827,Jeremy Brock,Julie Walters,Comedy Drama,Rupert Grint,Driving Lessons,Tamsin Egerton,Jeremy Brock Julie Walters Comedy Drama Rupert Grint Tamsin Egerton
3828,Scott Foley,Greg Grunberg,Comedy Crime,Donald Faison,Let's Kill Ward's Wife,Dagmara Dominczyk,Scott Foley Greg Grunberg Comedy Crime Donald Faison Dagmara Dominczyk
3829,Tobe Hooper,Lou Perryman,Comedy Horror,Bill Johnson,The Texas Chainsaw Massacre 2,Jim Siedow,Tobe Hooper Lou Perryman Comedy Horror Bill Johnson Jim Siedow
3830,Sam Peckinpah,Bob Dylan,Biography Drama Romance Western,James Coburn,Pat Garrett & Billy the Kid,Jason Robards,Sam Peckinpah Bob Dylan Biography Drama Romance Western James Coburn Jason Robards
3831,Nicolas Winding Refn,Kristin Scott Thomas,Crime Drama,Ryan Gosling,Only God Forgives,Yayaying Rhatha Phongam,Nicolas Winding Refn Kristin Scott Thomas Crime Drama Ryan Gosling Yayaying Rhatha Phongam
3832,Christophe Ali,Isild Le Besco,Drama,Denis Lavant,Camping sauvage,Emmanuelle Bercot,Christophe Ali Isild Le Besco Drama Denis Lavant Emmanuelle Bercot
