,director_name,actor_2_name,genres,actor_1_name,movie_title,actor_3_name,combined
2311,Richard Linklater,Keanu Reeves,Animation Drama Mystery Sci-Fi Thriller,Robert Downey Jr.,A Scanner Darkly,Rory Cochrane,Richard Linklater Keanu Reeves Animation Drama Mystery Sci-Fi Thriller Robert Downey Jr. Rory Cochrane
2312,Michael Apted,Abigail Spencer,Biography Drama Sport,Gerard Butler,Chasing Mavericks,Leven Rambin,Michael Apted Abigail Spencer Biography Drama Sport Gerard Butler Leven Rambin
2313,Uwe Boll,Darren Shahlavi,Horror Sci-Fi,Catherine Lough Haggquist,Alone in the Dark,Karin Konoval,Uwe Boll Darren Shahlavi Horror Sci-Fi Catherine Lough Haggquist Karin Konoval
2314,Todd Graff,Charlie Saxton,Comedy Drama Family Music Romance,Scott Porter,Bandslam,Ryan Donowho,Todd Graff Charlie Saxton Comedy Drama Family Music Romance Scott Porter Ryan Donowho
2315,Jonathan Glazer,Anne Heche,Drama Mystery Romance Thriller,Cameron Bright,Birth,Danny Huston,Jonathan Glazer Anne Heche Drama Mystery Romance Thriller Cameron Bright Danny Huston
2316,J.C. Chandor,Ashley Williams,Action Crime Drama Thriller,David Oyelowo,A Most Violent Year,Albert Brooks,J.C. Chandor Ashley Williams Action Crime Drama Thriller David Oyelowo Albert Brooks
2317,Paul Gross,Michael Greyeyes,Drama History Romance War,Landon Liboiron,Passchendaele,Caroline Dhavernas,Paul Gross Michael Greyeyes Drama History Romance War Landon Liboiron Caroline Dhavernas
2318,Marc Abraham,Bill Lake,Biography Drama,Dylan Authors,Flash of Genius,Victoria Learn,Marc Abraham Bill Lake Biography Drama Dylan Authors Victoria Learn
2319,Todd Haynes,Heath Ledger,Biography Drama Music,Christian Bale,I'm Not There.,Tyrone Benskin,Todd Haynes Heath Ledger Biography Drama Music Christian Bale Tyrone Benskin
2320,Mabrouk El Mechri,Bruce Willis,Action Thriller,Henry Cavill,The Cold Light of Day,Óscar Jaenada,Mabrouk El Mechri Bruce Willis Action Thriller Henry Cavill Óscar Jaenada
2321,Rian Johnson,Maximilian Schell,Adventure Comedy Drama Romance,Zachary Gordon,The Brothers Bloom,Nora Zehetner,Rian Johnson Maximilian Schell Adventure Comedy Drama Romance Zachary Gordon Nora Zehetner
2322,Charlie Kaufman,Jennifer Jason Leigh,Comedy Drama Romance,Philip Seymour Hoffman,"Synecdoche, New York",Samantha Morton,Charlie Kaufman Jennifer Jason Leigh Comedy Drama Romance Philip Seymour Hoffman Samantha Morton
2323,Hayao Miyazaki,Jada Pinkett Smith,Adventure Animation Fantasy,Minnie Driver,Princess Mononoke,Billy Crudup,Hayao Miyazaki Jada Pinkett Smith Adventure Animation Fantasy Minnie Driver Billy Crudup
2324,Jean-Paul Rappeneau,Peter Coyote,Comedy Drama Mystery Romance Thriller War,Isabelle Adjani,Bon voyage,Virginie Ledoyen,Jean-Paul Rappeneau Peter Coyote Comedy Drama Mystery Romance Thriller War Isabelle Adjani Virginie Ledoyen
2325,Nancy Walker,Randy Jones,Biography Comedy Musical,Steve Guttenberg,Can't Stop the Music,Caitlyn Jenner,Nancy Walker Randy Jones Biography Comedy Musical Steve Guttenberg Caitlyn Jenner
2326,John Hillcoat,Noah Taylor,Crime Drama Western,Ray Winstone,The Proposition,Danny Huston,John Hillcoat Noah Taylor Crime Drama Western Ray Winstone Danny Huston
2327,Angelo Pizzo,Finn Wittrock,Biography Drama Sport,Donny Boaz,Courage,Brent Anderson,Angelo Pizzo Finn Wittrock Biography Drama Sport Donny Boaz Brent Anderson
2328,Richard Benjamin,Jane Krakowski,Comedy Music,Damon Wayans,Marci X,Paula Garcés,Richard Benjamin Jane Krakowski Comedy Music Damon Wayans Paula Garcés
2329,Kurt Wimmer,Emily Watson,Action Drama Sci-Fi Thriller,Christian Bale,Equilibrium,Sean Pertwee,Kurt Wimmer Emily Watson Action Drama Sci-Fi Thriller Christian Bale Sean Pertwee
2330,Roger Spottiswoode,Guang Li,Drama War,Radha Mitchell,The Children of Huang Shi,Matthew Walker,Roger Spottiswoode Guang Li Drama War Radha Mitchell Matthew Walker
2331,James Gray,Ellen Burstyn,Crime Drama Romance Thriller,Charlize Theron,The Yards,Faye Dunaway,James Gray Ellen Burstyn Crime Drama Romance Thriller Charlize Theron Faye Dunaway
2332,Matthew Diamond,Garrett Clayton,Adventure Family Fantasy Musical,Chazz Palminteri,The Oogieloves in the Big Balloon Adventure,Toni Braxton,Matthew Diamond Garrett Clayton Adventure Family Fantasy Musical Chazz Palminteri Toni Braxton
2333,Angelina Jolie Pitt,Angelina Jolie Pitt,Drama Romance,Brad Pitt,By the Sea,Melvil Poupaud,Angelina Jolie Pitt Angelina Jolie Pitt Drama Romance Brad Pitt Melvil Poupaud
2334,Katsuhiro Ôtomo,Robin Atkin Downes,Action Adventure Animation Family Sci-Fi Thriller,William Hootkins,Steamboy,Rosalind Ayres,Katsuhiro Ôtomo Robin Atkin Downes Action Adventure Animation Family Sci-Fi Thriller William Hootkins Rosalind Ayres
2335,David Anspaugh,Costas Mandylor,Drama History Sport,Gerard Butler,The Game of Their Lives,Jimmy Jean-Louis,David Anspaugh Costas Mandylor Drama History Sport Gerard Butler Jimmy Jean-Louis
2336,Andrew Jarecki,Kirsten Dunst,Crime Drama Mystery Romance Thriller,Ryan Gosling,All Good Things,Frank Langella,Andrew Jarecki Kirsten Dunst Crime Drama Mystery Romance Thriller Ryan Gosling Frank Langella
2337,Kevin Reynolds,Jason Scott Lee,Action Adventure Drama History Romance,Esai Morales,Rapa Nui,Sandrine Holt,Kevin Reynolds Jason Scott Lee Action Adventure Drama History Romance Esai Morales Sandrine Holt
2338,Stephen Chow,Yuqi Zhang,Comedy Family Sci-Fi,Jiao Xu,CJ7,Chi Chung Lam,Stephen Chow Yuqi Zhang Comedy Family Sci-Fi Jiao Xu Chi Chung Lam
2339,Jean-Marie Poiré,Philippe Nahon,Comedy Family Fantasy Sci-Fi,Christian Clavier,Les couloirs du temps: Les visiteurs II,Marie-Anne Chazel,Jean-Marie Poiré Philippe Nahon Comedy Family Fantasy Sci-Fi Christian Clavier Marie-Anne Chazel
2340,Kevin Munroe,Laura Spencer,Action Comedy Crime Fantasy Horror Mystery Sci-Fi Thriller,Marco St. John,Dylan Dog: Dead of Night,Anita Briem,Kevin Munroe Laura Spencer Action Comedy Crime Fantasy Horror Mystery Sci-Fi Thriller Marco St. John Anita Briem
2341,Daniel Algrant,Richard Schiff,Crime Drama Mystery,Al Pacino,People I Know,Mark Webber,Daniel Algrant Richard Schiff Crime Drama Mystery Al Pacino Mark Webber
2343,Julie Taymor,Reeve Carney,Comedy Drama Fantasy Romance,Djimon Hounsou,The Tempest,Tom Conti,Julie Taymor Reeve Carney Comedy Drama Fantasy Romance Djimon Hounsou Tom Conti
2344,Alejandro Amenábar,Aaron Ashmore,Crime Drama Mystery Thriller,Emma Watson,Regression,Julian Richings,Alejandro Amenábar Aaron Ashmore Crime Drama Mystery Thriller Emma Watson Julian Richings
2345,Jane Clark,Traci Dinwiddie,Romance Short,Necar Zadegan,The Touch,Elea Oberon,Jane Clark Traci Dinwiddie Romance Short Necar Zadegan Elea Oberon
2346,Daniel Lee,Sammo Kam-Bo Hung,Action Drama History War,Andy Lau,Three Kingdoms: Resurrection of the Dragon,Andy On,Daniel Lee Sammo Kam-Bo Hung Action Drama History War Andy Lau Andy On
2347,Mike Barker,Nicholas Lea,Crime Drama Thriller,Gerard Butler,Shattered,Callum Rennie,Mike Barker Nicholas Lea Crime Drama Thriller Gerard Butler Callum Rennie
2348,Wayne Thornley,Phil LaMarr,Adventure Animation Comedy Family,Leonard Nimoy,Zambezia,Noureen DeWulf,Wayne Thornley Phil LaMarr Adventure Animation Comedy Family Leonard Nimoy Noureen DeWulf
2349,Gnana Rajasekaran,Michael Lieber,Biography Drama History,Mani Bharathi,Ramanujan,Kevin McGowan,Gnana Rajasekaran Michael Lieber Biography Drama History Mani Bharathi Kevin McGowan
2350,Tom Walsh,Maggie Wheeler,Animation,Joey D. Vieira,Dwegons and Leprechauns,Jacqueline Lovell,Tom Walsh Maggie Wheeler Animation Joey D. Vieira Jacqueline Lovell
2351,Jonathan Jakubowicz,Jurnee Smollett-Bell,Action Biography Drama Sport,Robert De Niro,Hands of Stone,Edgar Ramírez,Jonathan Jakubowicz Jurnee Smollett-Bell Action Biography Drama Sport Robert De Niro Edgar Ramírez
2352,James McTeigue,Roger Rees,Action Crime Thriller,Milla Jovovich,Survivor,Robert Forster,James McTeigue Roger Rees Action Crime Thriller Milla Jovovich Robert Forster
2353,Scott Walker,Radha Mitchell,Crime Drama Mystery Thriller,Nicolas Cage,The Frozen Ground,Jodi Lyn O'Keefe,Scott Walker Radha Mitchell Crime Drama Mystery Thriller Nicolas Cage Jodi Lyn O'Keefe
2354,John Curran,Sally Hawkins,Drama Romance,Toby Jones,The Painted Veil,Alan David,John Curran Sally Hawkins Drama Romance Toby Jones Alan David
2355,Uli Edel,Alexandra Maria Lara,Action Biography Crime Drama,Moritz Bleibtreu,The Baader Meinhof Complex,Martina Gedeck,Uli Edel Alexandra Maria Lara Action Biography Crime Drama Moritz Bleibtreu Martina Gedeck
2356,Kevin Costner,Michael Spears,Adventure Drama Western,Mary McDonnell,Dances with Wolves,Maury Chaykin,Kevin Costner Michael Spears Adventure Drama Western Mary McDonnell Maury Chaykin
2357,Jake Kasdan,John Michael Higgins,Comedy,Justin Timberlake,Bad Teacher,Phyllis Smith,Jake Kasdan John Michael Higgins Comedy Justin Timberlake Phyllis Smith
2358,Harold Becker,Michael O'Neill,Crime Drama Mystery Thriller,Al Pacino,Sea of Love,Ellen Barkin,Harold Becker Michael O'Neill Crime Drama Mystery Thriller Al Pacino Ellen Barkin
2359,Mark Rosman,Lin Shaye,Comedy Family Romance,Dan Byrd,A Cinderella Story,Julie Gonzalo,Mark Rosman Lin Shaye Comedy Family Romance Dan Byrd Julie Gonzalo
2360,Wes Craven,W. Earl Brown,Horror Mystery,David Arquette,Scream,Roger Jackson,Wes Craven W. Earl Brown Horror Mystery David Arquette Roger Jackson
2361,Steve Beck,Embeth Davidtz,Horror,Shannon Elizabeth,Thir13en Ghosts,F. Murray Abraham,Steve Beck Embeth Davidtz Horror Shannon Elizabeth F. Murray Abraham
2362,Stanley Kubrick,Shelley Duvall,Drama Horror,Scatman Crothers,The Shining,Joe Turkel,Stanley Kubrick Shelley Duvall Drama Horror Scatman Crothers Joe Turkel
2363,Robert Zemeckis,Thomas F. Wilson,Adventure Comedy Sci-Fi,Lea Thompson,Back to the Future,J.J. Cohen,Robert Zemeckis Thomas F. Wilson Adventure Comedy Sci-Fi Lea Thompson J.J. Cohen
2364,William Malone,Peter Gallagher,Horror Mystery Thriller,Jeffrey Combs,House on Haunted Hill,Bridgette Wilson-Sampras,William Malone Peter Gallagher Horror Mystery Thriller Jeffrey Combs Bridgette Wilson-Sampras
2365,Tyler Perry,Mary J. Blige,Comedy Drama,Eric Mendenhall,I Can Do Bad All by Myself,Hope Olaide Wilson,Tyler Perry Mary J. Blige Comedy Drama Eric Mendenhall Hope Olaide Wilson
2366,Rob Hawk,Erin O'Brien,Action Drama,Kari J. Kramer,Fight Valley,Cabrina Collesides,Rob Hawk Erin O'Brien Action Drama Kari J. Kramer Cabrina Collesides
2367,Josh Gordon,Scott Elrod,Comedy Drama Romance,Caroline Dhavernas,The Switch,Kelli Barrett,Josh Gordon Scott Elrod Comedy Drama Romance Caroline Dhavernas Kelli Barrett
2368,Shawn Levy,David Agranov,Comedy Romance,Taran Killam,Just Married,David Moscow,Shawn Levy David Agranov Comedy Romance Taran Killam David Moscow
2369,Lee Tamahori,Dominic Cooper,Biography Drama Thriller,Mem Ferda,The Devil's Double,Ludivine Sagnier,Lee Tamahori Dominic Cooper Biography Drama Thriller Mem Ferda Ludivine Sagnier
2371,Britt Allcroft,Colm Feore,Adventure Comedy Drama Family Fantasy,Mara Wilson,Thomas and the Magic Railroad,Peter Fonda,Britt Allcroft Colm Feore Adventure Comedy Drama Family Fantasy Mara Wilson Peter Fonda
2372,Breck Eisner,Glenn Morshower,Horror Thriller,Radha Mitchell,The Crazies,John Aylward,Breck Eisner Glenn Morshower Horror Thriller Radha Mitchell John Aylward
2373,Hayao Miyazaki,Ryûnosuke Kamiki,Adventure Animation Family Fantasy,Bunta Sugawara,Spirited Away,Miyu Irino,Hayao Miyazaki Ryûnosuke Kamiki Adventure Animation Family Fantasy Bunta Sugawara Miyu Irino
2374,Alan Yuen,Michael Wong,Action Crime Thriller,Andy Lau,Firestorm,Terence Yin,Alan Yuen Michael Wong Action Crime Thriller Andy Lau Terence Yin
2375,Roger Donaldson,Anthony Hopkins,Action Adventure Drama History Romance,Liam Neeson,The Bounty,Laurence Olivier,Roger Donaldson Anthony Hopkins Action Adventure Drama History Romance Liam Neeson Laurence Olivier
2376,Brian Percival,Sophie Nélisse,Drama War,Emily Watson,The Book Thief,Roger Allam,Brian Percival Sophie Nélisse Drama War Emily Watson Roger Allam
2377,Sean Anders,Michael Cudlitz,Adventure Comedy Romance,Katrina Bowden,Sex Drive,Alice Greczyn,Sean Anders Michael Cudlitz Adventure Comedy Romance Katrina Bowden Alice Greczyn
2378,Anand Tucker,Kaitlin Olson,Comedy Romance,Adam Scott,Leap Year,Dominique McElligott,Anand Tucker Kaitlin Olson Comedy Romance Adam Scott Dominique McElligott
2379,Anthony Mann,Mel Ferrer,Drama History War,James Mason,The Fall of the Roman Empire,Stephen Boyd,Anthony Mann Mel Ferrer Drama History War James Mason Stephen Boyd
2380,Michael Dowse,Michael Biehn,Comedy Drama Romance,Topher Grace,Take Me Home Tonight,Dan Fogler,Michael Dowse Michael Biehn Comedy Drama Romance Topher Grace Dan Fogler
2381,Daniel Barnz,Rosie Perez,Drama,Holly Hunter,Won't Back Down,Dante Brown,Daniel Barnz Rosie Perez Drama Holly Hunter Dante Brown
2382,Emile Ardolino,Kyra Nichols,Family Fantasy Music,Darci Kistler,The Nutcracker,Margaret Tracey,Emile Ardolino Kyra Nichols Family Fantasy Music Darci Kistler Margaret Tracey
2383,Robert Altman,Jennifer Jason Leigh,Crime Drama Music Thriller,Steve Buscemi,Kansas City,Miranda Richardson,Robert Altman Jennifer Jason Leigh Crime Drama Music Thriller Steve Buscemi Miranda Richardson
2384,James Schamus,Sarah Gadon,Drama,Logan Lerman,Indignation,Tracy Letts,James Schamus Sarah Gadon Drama Logan Lerman Tracy Letts
2385,Andrew Douglas,Chloë Grace Moretz,Drama Horror Mystery Thriller,Jimmy Bennett,The Amityville Horror,Ryan Reynolds,Andrew Douglas Chloë Grace Moretz Drama Horror Mystery Thriller Jimmy Bennett Ryan Reynolds
2386,Spike Jonze,Meryl Streep,Comedy Drama,Nicolas Cage,Adaptation.,Roger Willie,Spike Jonze Meryl Streep Comedy Drama Nicolas Cage Roger Willie
2387,George A. Romero,Shawn Roberts,Horror,Tony Nappo,Land of the Dead,Pedro Miguel Arce,George A. Romero Shawn Roberts Horror Tony Nappo Pedro Miguel Arce
2388,Danny Pang,Angelica Lee,Action,Louis Koo,Out of Inferno,Ching Wan Lau,Danny Pang Angelica Lee Action Louis Koo Ching Wan Lau
2389,Terry Gilliam,Michael Jeter,Adventure Comedy Drama,Johnny Depp,Fear and Loathing in Las Vegas,Ellen Barkin,Terry Gilliam Michael Jeter Adventure Comedy Drama Johnny Depp Ellen Barkin
2390,Ricky Gervais,Tina Fey,Comedy Fantasy Romance,Jennifer Garner,The Invention of Lying,Martin Starr,Ricky Gervais Tina Fey Comedy Fantasy Romance Jennifer Garner Martin Starr
2391,Nicholas Stoller,Carla Gallo,Comedy,Craig Roberts,Neighbors,Ike Barinholtz,Nicholas Stoller Carla Gallo Comedy Craig Roberts Ike Barinholtz
2392,Chuck Russell,Amy Yasbeck,Action Comedy Crime Fantasy,Peter Greene,The Mask,Reg E. Cathey,Chuck Russell Amy Yasbeck Action Comedy Crime Fantasy Peter Greene Reg E. Cathey
2393,Penny Marshall,Jon Lovitz,Comedy Drama Family Fantasy Romance,Tom Hanks,Big,John Heard,Penny Marshall Jon Lovitz Comedy Drama Family Fantasy Romance Tom Hanks John Heard
2394,Larry Charles,Ken Davitian,Comedy,Luenell,Borat: Cultural Learnings of America for Make Benefit Glorious Nation of Kazakhstan,Chester,Larry Charles Ken Davitian Comedy Luenell Chester
2395,Robert Luketic,Raquel Welch,Comedy Romance,Linda Cardellini,Legally Blonde,Alanna Ubach,Robert Luketic Raquel Welch Comedy Romance Linda Cardellini Alanna Ubach
2396,Leonard Nimoy,Nichelle Nichols,Action Adventure Sci-Fi,Leonard Nimoy,Star Trek III: The Search for Spock,Walter Koenig,Leonard Nimoy Nichelle Nichols Action Adventure Sci-Fi Leonard Nimoy Walter Koenig
2397,Scott Derrickson,Colm Feore,Drama Horror Thriller,Tom Wilkinson,The Exorcism of Emily Rose,JR Bourne,Scott Derrickson Colm Feore Drama Horror Thriller Tom Wilkinson JR Bourne
2398,Mike Mitchell,Eddie Griffin,Comedy Romance,Amy Poehler,Deuce Bigalow: Male Gigolo,Bree Turner,Mike Mitchell Eddie Griffin Comedy Romance Amy Poehler Bree Turner
2399,Vic Armstrong,Lea Thompson,Action Drama Fantasy Mystery Thriller,Nicolas Cage,Left Behind,Quinton Aaron,Vic Armstrong Lea Thompson Action Drama Fantasy Mystery Thriller Nicolas Cage Quinton Aaron
2400,Thomas Bezucha,Paul Schneider,Comedy Drama Romance,Craig T. Nelson,The Family Stone,Tyrone Giordano,Thomas Bezucha Paul Schneider Comedy Drama Romance Craig T. Nelson Tyrone Giordano
2401,Kevin Rodney Sullivan,Sean Patrick Thomas,Comedy Drama,Harry Lennix,Barbershop 2: Back in Business,Kenan Thompson,Kevin Rodney Sullivan Sean Patrick Thomas Comedy Drama Harry Lennix Kenan Thompson
2402,Terry Zwigoff,Tony Cox,Comedy Crime Drama,Bernie Mac,Bad Santa,Alex Borstein,Terry Zwigoff Tony Cox Comedy Crime Drama Bernie Mac Alex Borstein
2403,Jay Roach,Charles Napier,Comedy Crime,Will Ferrell,Austin Powers: International Man of Mystery,Robert Wagner,Jay Roach Charles Napier Comedy Crime Will Ferrell Robert Wagner
2404,Kirk Jones,Louis Mandylor,Comedy Family Romance,Nia Vardalos,My Big Fat Greek Wedding 2,Joey Fatone,Kirk Jones Louis Mandylor Comedy Family Romance Nia Vardalos Joey Fatone
2405,David Bowers,Rachael Harris,Comedy Family,Zachary Gordon,Diary of a Wimpy Kid: Rodrick Rules,Fran Kranz,David Bowers Rachael Harris Comedy Family Zachary Gordon Fran Kranz
2406,John McTiernan,Bill Duke,Action Horror Sci-Fi,Shane Black,Predator,Carl Weathers,John McTiernan Bill Duke Action Horror Sci-Fi Shane Black Carl Weathers
2407,Milos Forman,F. Murray Abraham,Biography Drama History Music,Jeffrey Jones,Amadeus,Tom Hulce,Milos Forman F. Murray Abraham Biography Drama History Music Jeffrey Jones Tom Hulce
2408,Nelson McCormick,Scott Porter,Horror Mystery,Ming-Na Wen,Prom Night,Collins Pennie,Nelson McCormick Scott Porter Horror Mystery Ming-Na Wen Collins Pennie
2409,Mark Waters,Amy Poehler,Comedy,Tina Fey,Mean Girls,Neil Flynn,Mark Waters Amy Poehler Comedy Tina Fey Neil Flynn
2410,Audrey Wells,Lindsay Duncan,Comedy Drama Romance,Raoul Bova,Under the Tuscan Sun,Mario Monicelli,Audrey Wells Lindsay Duncan Comedy Drama Romance Raoul Bova Mario Monicelli
2411,Robert Altman,Bob Balaban,Drama Mystery,Kristin Scott Thomas,Gosford Park,Tom Hollander,Robert Altman Bob Balaban Drama Mystery Kristin Scott Thomas Tom Hollander
2413,Francis Ford Coppola,Kathleen Turner,Comedy Drama Fantasy Romance,Nicolas Cage,Peggy Sue Got Married,Joan Allen,Francis Ford Coppola Kathleen Turner Comedy Drama Fantasy Romance Nicolas Cage Joan Allen
2414,Alejandro G. Iñárritu,Naomi Watts,Comedy Drama Romance,Emma Stone,Birdman or (The Unexpected Virtue of Ignorance),Merritt Wever,Alejandro G. Iñárritu Naomi Watts Comedy Drama Romance Emma Stone Merritt Wever
2415,Woody Allen,Charlie Tahan,Drama,Sally Hawkins,Blue Jasmine,Andrew Dice Clay,Woody Allen Charlie Tahan Drama Sally Hawkins Andrew Dice Clay
2416,Paul Greengrass,David Alan Basche,Drama History Thriller,Christian Clemenson,United 93,Susan Blommaert,Paul Greengrass David Alan Basche Drama History Thriller Christian Clemenson Susan Blommaert
2417,Bille Woodruff,Mekhi Phifer,Drama Music Romance,Christian Monzon,Honey,Romeo Miller,Bille Woodruff Mekhi Phifer Drama Music Romance Christian Monzon Romeo Miller
2418,Edward Zwick,Morgan Freeman,Drama History War,Denzel Washington,Glory,Matthew Broderick,Edward Zwick Morgan Freeman Drama History War Denzel Washington Matthew Broderick
2419,Rick Friedberg,Barry Bostwick,Action Comedy,Hulk Hogan,Spy Hard,Nicollette Sheridan,Rick Friedberg Barry Bostwick Action Comedy Hulk Hogan Nicollette Sheridan
2420,John Carpenter,Hal Holbrook,Fantasy Horror,Jamie Lee Curtis,The Fog,Janet Leigh,John Carpenter Hal Holbrook Fantasy Horror Jamie Lee Curtis Janet Leigh
2421,Sean McNamara,Chris Brochu,Biography Drama Family Sport,Dennis Quaid,Soul Surfer,Craig T. Nelson,Sean McNamara Chris Brochu Biography Drama Family Sport Dennis Quaid Craig T. Nelson
2422,Mike Nichols,Bob Balaban,Comedy Drama War,Bob Newhart,Catch-22,Martin Balsam,Mike Nichols Bob Balaban Comedy Drama War Bob Newhart Martin Balsam
2423,Jody Hill,Celia Weston,Comedy Crime Drama,Collette Wolfe,Observe and Report,Dan Bakkedahl,Jody Hill Celia Weston Comedy Crime Drama Collette Wolfe Dan Bakkedahl
2424,Richard Fleischer,Olivia d'Abo,Action Adventure Fantasy,Mako,Conan the Destroyer,Grace Jones,Richard Fleischer Olivia d'Abo Action Adventure Fantasy Mako Grace Jones
2425,Martin Scorsese,Cathy Moriarty,Biography Drama Sport,Robert De Niro,Raging Bull,Frank Vincent,Martin Scorsese Cathy Moriarty Biography Drama Sport Robert De Niro Frank Vincent
2426,Brandon Camp,Sasha Alexander,Drama Romance,Judy Greer,Love Happens,Frances Conroy,Brandon Camp Sasha Alexander Drama Romance Judy Greer Frances Conroy
2427,Barry Levinson,Roger Ashton-Griffiths,Adventure Fantasy Mystery Thriller,Nicholas Rowe,Young Sherlock Holmes,Freddie Jones,Barry Levinson Roger Ashton-Griffiths Adventure Fantasy Mystery Thriller Nicholas Rowe Freddie Jones
2428,Kevin Tancharoen,Kay Panabaker,Comedy Drama Musical Romance,Kelsey Grammer,Fame,Megan Mullally,Kevin Tancharoen Kay Panabaker Comedy Drama Musical Romance Kelsey Grammer Megan Mullally
2429,Danny Boyle,Treat Williams,Adventure Biography Drama Thriller,James Franco,127 Hours,Kate Burton,Danny Boyle Treat Williams Adventure Biography Drama Thriller James Franco Kate Burton
2430,Woody Allen,Jon Lovitz,Comedy Crime,Woody Allen,Small Time Crooks,Michael Rapaport,Woody Allen Jon Lovitz Comedy Crime Woody Allen Michael Rapaport
2431,Nicholas Hytner,Susan May Pratt,Drama Music Romance,Amanda Schull,Center Stage,Ethan Stiefel,Nicholas Hytner Susan May Pratt Drama Music Romance Amanda Schull Ethan Stiefel
2432,Jessie Nelson,Alex Borstein,Comedy,Olivia Wilde,Love the Coopers,Timothée Chalamet,Jessie Nelson Alex Borstein Comedy Olivia Wilde Timothée Chalamet
2433,Bart Freundlich,Corbin Bleu,Comedy Crime,Kristen Stewart,Catch That Kid,Kevin G. Schmidt,Bart Freundlich Corbin Bleu Comedy Crime Kristen Stewart Kevin G. Schmidt
2434,Irwin Winkler,Hayden Christensen,Drama,Ian Somerhalder,Life as a House,Kristin Scott Thomas,Irwin Winkler Hayden Christensen Drama Ian Somerhalder Kristin Scott Thomas
2435,Danny Boyle,Michael Fassbender,Biography Drama,Kate Winslet,Steve Jobs,Michael Stuhlbarg,Danny Boyle Michael Fassbender Biography Drama Kate Winslet Michael Stuhlbarg
2436,Chris Columbus,Marie Avgeropoulos,Comedy Romance,Alan Ruck,"I Love You, Beth Cooper",Shawn Roberts,Chris Columbus Marie Avgeropoulos Comedy Romance Alan Ruck Shawn Roberts
2437,Miguel Arteta,Ari Graynor,Comedy Drama Romance,Steve Buscemi,Youth in Revolt,Fred Willard,Miguel Arteta Ari Graynor Comedy Drama Romance Steve Buscemi Fred Willard
2438,William A. Fraker,Richard Farnsworth,Action Adventure Western,Jason Robards,The Legend of the Lone Ranger,Michael Horse,William A. Fraker Richard Farnsworth Action Adventure Western Jason Robards Michael Horse
2439,John Boorman,Jamie Lee Curtis,Drama Thriller,Daniel Radcliffe,The Tailor of Panama,Mark Margolis,John Boorman Jamie Lee Curtis Drama Thriller Daniel Radcliffe Mark Margolis
2440,Brian De Palma,Dennis Franz,Mystery Thriller,Nancy Allen,Blow Out,John McMartin,Brian De Palma Dennis Franz Mystery Thriller Nancy Allen John McMartin
2441,Courtney Solomon,Paul Freeman,Action Crime Thriller,Rebecca Budig,Getaway,Bruce Payne,Courtney Solomon Paul Freeman Action Crime Thriller Rebecca Budig Bruce Payne
2442,Ang Lee,Kate Burton,Drama,Joan Allen,The Ice Storm,Henry Czerny,Ang Lee Kate Burton Drama Joan Allen Henry Czerny
2443,Rob Reiner,Annie Parisse,Comedy Drama Romance,Yaya DaCosta,And So It Goes,Frankie Valli,Rob Reiner Annie Parisse Comedy Drama Romance Yaya DaCosta Frankie Valli
2444,Jeff Kanew,Shelley Long,Adventure Comedy,Craig T. Nelson,Troop Beverly Hills,Kellie Martin,Jeff Kanew Shelley Long Adventure Comedy Craig T. Nelson Kellie Martin
2445,István Szabó,Shaun Evans,Comedy Drama Romance,Miriam Margolyes,Being Julia,Juliet Stevenson,István Szabó Shaun Evans Comedy Drama Romance Miriam Margolyes Juliet Stevenson
2446,Adrian Lyne,Karen Young,Drama Romance,David Margulies,9½ Weeks,Kim Chan,Adrian Lyne Karen Young Drama Romance David Margulies Kim Chan
2447,Matthew Robbins,Ralph Richardson,Action Adventure Fantasy,Ian McDiarmid,Dragonslayer,Albert Salmi,Matthew Robbins Ralph Richardson Action Adventure Fantasy Ian McDiarmid Albert Salmi
2448,Michael Hoffman,Kerry Condon,Biography Drama Romance,David Masterson,The Last Station,Anne-Marie Duff,Michael Hoffman Kerry Condon Biography Drama Romance David Masterson Anne-Marie Duff
2449,Tim Burton,Bill Murray,Biography Comedy Drama,Johnny Depp,Ed Wood,Martin Landau,Tim Burton Bill Murray Biography Comedy Drama Johnny Depp Martin Landau
2450,Jason Reitman,Kate Winslet,Drama,J.K. Simmons,Labor Day,Brooke Smith,Jason Reitman Kate Winslet Drama J.K. Simmons Brooke Smith
2451,Sergey Bodrov,Khulan Chuluun,Adventure Biography Drama History War,Tadanobu Asano,Mongol: The Rise of Genghis Khan,Honglei Sun,Sergey Bodrov Khulan Chuluun Adventure Biography Drama History War Tadanobu Asano Honglei Sun
2452,Guy Ritchie,Gerard Butler,Action Crime Thriller,Tom Hardy,RocknRolla,Tom Wilkinson,Guy Ritchie Gerard Butler Action Crime Thriller Tom Hardy Tom Wilkinson
2453,Hal Needham,Michael Beck,Action Sci-Fi,Barry Bostwick,Megaforce,Henry Silva,Hal Needham Michael Beck Action Sci-Fi Barry Bostwick Henry Silva
2454,Kenneth Branagh,Brian Blessed,Drama,Julie Christie,Hamlet,Richard Briers,Kenneth Branagh Brian Blessed Drama Julie Christie Richard Briers
2455,Bruce Beresford,Suzie Steen,Biography Drama Music Romance,Bruce Greenwood,Mao's Last Dancer,Aden Young,Bruce Beresford Suzie Steen Biography Drama Music Romance Bruce Greenwood Aden Young
2456,Jeff Nichols,Sam Shepard,Adventure Drama Sci-Fi Thriller,Kirsten Dunst,Midnight Special,Paul Sparks,Jeff Nichols Sam Shepard Adventure Drama Sci-Fi Thriller Kirsten Dunst Paul Sparks
2457,Woody Allen,Stockard Channing,Comedy Romance,Woody Allen,Anything Else,Fisher Stevens,Woody Allen Stockard Channing Comedy Romance Woody Allen Fisher Stevens
2458,Jonathan Teplitzky,Colin Firth,Biography Drama Romance War,Jeremy Irvine,The Railway Man,Sam Reid,Jonathan Teplitzky Colin Firth Biography Drama Romance War Jeremy Irvine Sam Reid
